cleaned_snippet,rating_label
game graphic play like want story new player download good world long overall try explore fun line guy know funn vast questgood,positive
natlan quest solve like star start want world bug pop enter thing archon right clear canjust accure bring near impossible puzzle list organize person chapter liyue reach iv fontaine dock occupy goodbye,positive
game ve love star ll player use weapon account able ruin afraid hacker wanna suggest obtain upgrade dispose,positive
game character wonderful life play love quest lot like experience new player good wild storyline event hard wish bad month friend coop gameplay archon awesome real virtual reality dendro unable,positive
game graphic character control story good fix forward especially low place button screen action touch suck dpad movable adjust atleast unintentionally automatically adjustable,negative
nice game graphic character like good great storyline design mini pretty try explore voice cool act freely high ar boringi permanent,positive
game character ve play reward spend story good currency wish save fun combat hour begin super exhaust,positive
game think character update play year like quit good feel bad style problem actually rerun fact tartaglia join atp tired redownloade,negative
nice game graphic character love reward story good use event variety weapon artifact currency wish exploration fun problem bit build absolutely mechanic reroll option substat farming primogem chest,positive
game character update ve love quest issue space beautiful phone new recommend ok use storyline hard wish edit friend amazing thing archon mobile definitely understand wait fontaine couple sooooo teach hehe geo city glitchy,positive
leave load work datum pop try enter problem storage come message insufficient relogging,negative
game think character update quest dialogue reward story easy daily use resin great event improve big qol incredible fast skip quickly content strong building bore gi offer openworld recent engagement flaw continue painfully slow process pace prevent reader title,positive
game graphic update play year interesting impressed recommend player great lore storyline day cutscene friend especially gameplay highly enjoy awesome absolutely mechanic captivate constant ensure stay engage impressive reccomende till,positive
game character ve play add good day pretty need fight enemy actually strong definitely near upgrade high beginning mechanic youtuber sponsor yard tell slowly equipment mistake level possibly common ease introduce hook,positive
ve play year genshin quest recently laptop phone new download need problem main account wait automatically hv alt acc europe server tend switch extra resource asia,positive
game graphic genshin love lot player barely include run crash point fix smoothly app low set wifi mobile storage fps unplayable laggy incredibly manage dent optimize,negative
character year like start control story new add good breath wild world feel ago amazing explore huge fun combat reason fast voice actually damn cool act couple clone climb glide reactive impress free increase size enhance ui ability,positive
game ve play lot time dialogue story good end grind hard wish cutscene care feature hour skip annoy listen slowly sit replay dozen resourse literally,negative
game character ve play love story player pretty wish combat line skin come veteran hoyo diverse color,positive
character hoyoverse quest issue time paimon player change archon voice sure future understand hope late birthday celebration anecdote voiceless awkward embarrassing normalize amuse,positive
game character interesting time point way skip button absurd talk short sentence nerve,negative
game think character issue beautiful compatibility mode complete design run crash amazing domain right help recent crashed wander middle dialog force redo smooth,positive
game character issue beautiful new difficult great storyline grind improve currency repetitive gameplay qol area fun excellent patch domain rpg wait come primogem level weekly premium past notch,positive
game space phone download maybe point fix delete app especially people device thing sorry tell alright store certain,negative
game reward mini include build load completely work save low huge problem traveler actually wifi fine awesome fandom wait mind odd op teapot realmi currently phoneand teapoti press afterwardsthenit waitto furniture inexceptit awaywhich allow visit sweethard hoursand weather,negative
nice game graphic character ve time reward like story good end resin great feel long energy edit decide stunning low review upgrade farming response current opinion excessive chore struggle hassle cap cost consume,positive
game week graphic interesting space experience phone new good open bug excellent problem thing awesome storage know task large check,positive
natlan update play phone long crash work enter worth expensive fine soo fontaine smooth potato mondstadt total exspect carshs religion demand stack medium,positive
game thank hoyoverse ve time experience spend story improve little need set worth fight break aesthetic devs guess rush head loose perspective escape,positive
game week like leave end day save enjoy fine beginning redownloade entire wipe reset work far,positive
game music play year genshin love lot adventure good daily event different amazing especially art exploration service live novel puzzle constant nowadays piece minigame,positive
game character play year quest lot phone story end great hard enemy content small know tell press reset icon hit joystick thumb prosgreat consend,positive
game play quest like player day bad hate honestly cringe stuff actualy motivated literaly rank discoverd map,positive
character play interesting dialogue like new easy open use great world hard wish gameplay exploration fun second skip able level sit force neat frustrating lastly exist constellation,negative
game character scenery love quest satisfy beautiful experience new player feel downside bug explore especially button action chest climb territory meet expectation treasure teleportation designbgm pattern consistent disappear,positive
play star add controller android soon change lack support bored consider hope guy stop,positive
game character play genshin love quest interesting start quit impact good day pretty fix bug place line voice miss weird know normal npc pls,positive
nice game graphic play like android download good datum need gb ask mobile fact insane amazed asphalt gangstar vegas extreme requirement,positive
game character genshin love lot issue time beautiful story resin long hard build big bad fix delete datum hate exploration fun annoying storage past cap ftp sice yay storge,positive
game update love quest lot time recently experience want great crash point completely try explore change fun enjoy thing notice laggy come fact tend accomplish exploring think sign attention,positive
game character ll control experience add controller android good lack support proper miss hope overy deficult execute combo click io handle,positive
character year like end event feel lack skin help total entire honestly gripe actual surplus kind lazy release major lantern rite mod ban restrict compare number usually irrelevant,positive
game character like want player bad change pull banner random actually fine understand high honestly stuff standard useless luck lose pity hopefully,positive
game play love quest dialogue console phone boring storyline event long especially pc skip awesome stop large conversation unnecessary,positive
game update ve play year phone great fix bug problem sure screen mobile able tell hoyo damage text grass ice dvalin signora boss situation abt state cos denial woukd length,positive
game music hoyoverse love interesting like beautiful story open world run work explore team dev beautifully art style enjoy voice perfect finally fan hope favorite able instal act glad galaxy grow play legend zelda enormous complex timeless,positive
game play like beautiful ps look pop explore low place distance low building right devs map compare grass galaxy draw resolution polygon holder object toy block mountain belong tree rock disappointing version ultra,positive
game natlan lot time like star start spend player abyss daily run repetitive change qol fun focus thing consider finally listen deserve hoyo short far nonsense afford generous freebie screw,positive
game dialogue reward new end day different overall fun banner limit hour skip fine storage ridiculous understandable wait come recent sit kind usually version suck sense ascension material,positive
game character update play quest great design event maybe amazing especially bit future help wait frustrating idea description pause clue helpful,positive
game believe play reward like player good feel long overall possible consider fan rate wait begin pity reduce freetoplay eula,positive
game music character scenery love quest experience story resin storyline world event weapon long different big overall amazing gameplay incredible fun enjoy journey real effort building rate rerun super mechanic flaw tell pr respawn aside enjoyable astonishing passion,positive
game character love like story new currency gameplay fun tho bit gacha hope clear alot automatically option far stuff requirement competitive mission theirs non,positive
game scenery issue control long work try stunning people worth art style fun combat review journey storage ruin size devs phenomenal yes memory remember ignore hatefulspam bot joy,positive
game ve recently start event ping ms point try coop change kick problem get server asia check medium release relatively horrible asias hks participate hk test online router ill grateful resolve,positive
game ve play time launch connection fix bug work friend normally need kick device problem reinstall storage check devs reset amazingbut todays morning logo appear application notification uninstalle,negative
leave new end event need enjoy content unable voiceless replayable en va strike previous native language seek vas,positive
game graphic character thank hoyoverse play genshin reward start impact good storyline look wish completely month ago amazing obsess fantastic second actually create account fact know begin absolutely replay adore forever similar gem,positive
ve play year time star want event gameplay hour rating sooooo disappointing achievement progress,negative
game update time start difficult long enemy screen wait waste impossible conversation forever omg sooo stupid defeat unstable specially compat bcz camera ancle soooo fke stressfull,positive
game graphic scenery star story great gameplay need breathtake fun minute skip button annoying voice stop click major non beautifulbut problemthis waaaayyyyyyyyyyy talkingyap yap yapand conversationit paimonif watch anime movie,positive
game character update play year genshin love quest issue star new player good boring great bad maybe fix actually wifi definitely storage hook unbelievable lil addict def rlly require face,positive
game hoyoverse ve play genshin love load phone open developer pretty fix bug work delete try samsung gb sure screen let redownloade currently galaxy shut immediately wrong,positive
game graphic thank play love issue loading end open day look developer fix bug try forward need kick incredible fun screen ton absolutely hello lately,positive
game think play love star beautiful story player good great bad try amazing people review line guy ar devs map disappointing ill unconditionally friendly plan badluck satisfy matter lovely thankyou hoyoberse muahahahaeauheurys,positive
graphic character scenery lot like story good design event wish region thing main sorry cool permanent mistake mission soundtrack wonderfull diversity definelly characteristic english simulanka,positive
game thank hoyoverse happy like want end build challenge fun kinda thing annoying create right hope option helpful rewardsand teapotbut lake glitch st water foundation,positive
game play control experience phone old use wish bad work try amazing change fun reason pc available currently allow usually fold file controll wireless keyboard mouse accept recognize racing wasd,positive
character quest reward story new long exploration way banner feature random hour main archon waste option alt force npc aside dialouge unit basic drivel tab input infuriate,negative
game play quest interesting lot time dialogue reward star start story android bore great grind event feel explore challenge people fun lack purchase thing skip bore stop puzzle diversity covid pressured meta racial irl,positive
nice game character life ve play interesting ll phone add boring old run bad smoothly style way pc samsung bit service real fan galaxy glitch january th complaint soooooo se explode,positive
nice game graphic ve play time start ll phone long run smoothly device fun support feature menu possible mobile storage adjust automatically option optimize allow honestly glad memory external stick insert thr section analyze,positive
game welkin character like star spend want story good easy end grind little bad way domain money fine rate resource horrible burn bp difference scarcity roll artefact upwards dumb,positive
game character reward like want story player good easy grind feel hate lack thing soo puzzle free force lazy compare sooo dry community toxic,positive
game graphic truly character thank mihoyo hoyoverse ve play genshin space impact good great lore storyline design look edit amazing fantastic consider finally job cool far mainly hand,positive
game character natlan ve play year recently like experience story new aspect bore old end great lore design event feel pretty little especially repetitive gameplay special fun release overtime disappoint emilie sethos,positive
game character play year lot spend adventure add player easy weapon hard developer overall work need fun strong farming gi sign lose ascent lucky characterweapon artifek primogen intertwine fate gold mark forget,positive
game music character quest time like recommend world quality highly animation awesome literally addict perfeeect view,positive
game play quest time dialogue player bore great long bad cutscene cause dev people worth fight skip anymore actually mean read listen actual involve interaction tap,negative
life dialogue add boring gameplay skip button screen listen talk insane tap seriously literal min,negative
game character life genshin like impact world design feel completely work stunning team visual art style combat rpg unique offer openworld redefine expect pair expansive moment gorgeous personality endless possibility composition,positive
game reward good great world grind hard quality exploration skip button annoying building vast obtain primogem honestly extensive,positive
game hoyoverse love use event bad fix try hate problem voice let hope act recent en vas nahida studio ai mad,positive
game play love laptop story constantly crash fix work try amazing problem reinstall main annoying let login free roam restart,positive
game character quest experience new player lore downside ago change incredible exciting exploration problem banner main archon age rerun impossible flaw increase frustrating number similar craft stand memorable writing accommodate effectively,positive
game music character year story use great artifact plus overall fix qol exploration fantastic fun combat thing ton rng solid lifechange varied flexible improvement,positive
game play controller provide android platform use wild hard bad support thing mobile literally absurd release ios rd party interference,negative
game think play year quest lot issue space time dialogue paimon like phone story constantly good repeat pretty bad month repetitive pc quickly fall content let gacha glare early drastically fetch treat,negative
nice game character life genshin like beautiful story aspect great lore world design overall amazing region gameplay limitation thing main unique real cool tell fantasy inspire noticable accurately represent culture skintone mention fail deviate plotline traveller search twin,positive
character star pick want story commission storyline design wish try unlock people review annoying let reach dock cool option recent slow certain opinion achievement personal address poor max reputation nation sort interact board,positive
nice game character wonderful play genshin quest lot dialogue like star story end great world design day quality need perfectly style bit review main annoying fine deserve sit short mark unintereste patience fit,positive
game character reward like abyss ok great feel improve especially quality need exploration bit endgame content chance hoyo weekly certain allow release sort shall competitor market stale activity favourite,positive
game character ve play year love time experience recommend player good easy great storyline elemental pretty plot overall fix gameplay people highly fun understand bore know remember glitch accommodate reaction write pass,positive
game think update play lot end developer edit request low device enjoy anymore strong able unable slow size heavy,negative
game graphic character play genshin lot space star impact story adventure difficult design power overall need breathtake properly problem gb apart understand smooth sense strike rlly beginner fascinating advantage theory item rule knowledge error bonus humor,positive
game graphic play space story good pretty plot app happen kick reason problem tho consider laggy admit,positive
game graphic character like star spend end low drop chance laggy suggest primogem increase release charcater begginer pkayer wasteand characterthat,negative
game quest lot dialogue leave want run wish turn fun battle skip awesome fighting come bring ability talk bunch potential,positive
game time story good long pretty crash fix bug try amazing enter gameplay kick problem second smooth luck,positive
game buy welkin think mihoyo play year like new good open soon great world wish month try worth enjoy purchase user voice actor deal able free allow cost previous wow monthly effective korean,positive
graphic character like star story good bore great lore power pretty guy compare interaction nation respective outside aqthe mc showcase wuwa,positive
game buy week update play year genshin time recommend try dollar account able waste lose log send email respond,negative
graphic music character update love like start story add good commission design weapon different build region people low banner kinda skip button current cost pls release disappointing community value btw taste pg,positive
game graphic character play quest interesting lot want good grind artifact overall bad need save reason pc kinda main mobile able primogem pity version require rng par lorestory yeah mid greatfor okay guarantee,positive
game like phone story great plus run crash amazing gameplay need line mobile superb decent comment dream,positive
game ve play time like start long run lag crash cutscene month change kick device problem ill restart mid oppo ae black,positive
game character love reward like spend want new good boring design pull fun hour money impossible suck progress,positive
game character dialogue adventure mode point fun skip button endgame building reach slow rank hopefully endless curtain,negative
game character play end resin grind weapon artifact need worth area yr drop money come stay level boss defeat require item guarantee away today talent room sad bcuz pride,negative
game character play issue like story player difficult old world run bad fix bug gameplay fun thing random fall deaf ear ton later guy bring redownloade continue level increase late map early scale exp refuse needle,negative
game update genshin quest star impact provide complete close great developer fix bug app try suddenly stop omg th error today omgnice gamegreat animationsamaze charactersleisurely nature soundlike saurrrrr gooood october fixdo asap nahidas bday pleaseeee tbh,positive
game play year lot time dialogue story great term weapon artifact improve bad change qol banner limit original voice gacha tired entire major improvement generally form excited restriction deceive audience,negative
game character play love interesting story day turn friend amazing team animation fight ton roll nation scene twist emotional coaster,positive
game character play love reward beautiful leave difficult world design different pretty exploration enjoy battle gatcha review content puzzle current state nation sep undtrack topti disappoint frustrated lategame dull monotonous tedious socalled insult measly plain stingy,positive
game character believe play issue solve like experience phone new provide good storyline world connection lag point fix network choose fun hour laggy upgrade cool server disappear hk tw mo despite minor garble introduction intro oh provider indosat capable vibrant bright collection,positive
nice game dialogue easy way fun problem skip mean storage primogem,negative
game character update play issue experience want great especially speak lack annoying recent usually enjoyable resolve language english voiceover disjoint,negative
user droid support needy original period probably gatcha limitation expensive limit banner passover battle purchase pc google oct fun save friend point overall wish long grind use end like time update character week launch compatibility ps difficult hardly platform download ratio calculate player android provide product apple company separate controller add want play game,negative
uninstalle notification application appear logo morning todays amazingbut reset devs check storage reinstall problem device kick need normally friend work bug fix connection time ve launch compatibility ps difficult hardly platform download ratio calculate player android provide product apple company separate controller add want play game,negative
literally resourse dozen replay sit slowly listen annoying skip hour feature care cutscene wish hard grind dialogue time lot play ve soon uninstall close resin use commission open routine daily complete ok mode end easy abyss old boring good wise player new story quest game,negative
constellation exist lastly frustrating neat force sit level able skip second fun exploration gameplay wish hard world great like dialogue interesting play character soon uninstall close resin use commission open routine daily complete ok mode end easy abyss old boring good wise player new story quest game,negative
constellation exist lastly frustrating neat force sit level able skip second fun exploration gameplay wish hard world great like dialogue interesting play character soon uninstall close resin use commission open routine daily complete ok mode end easy abyss old boring good wise player new story quest game,negative
pride bcuz sad room talent today away guarantee item require defeat boss level stay come money drop yrs area worth need artifact weapon grind play character soon uninstall close resin use commission open routine daily complete ok mode end easy abyss old boring good wise player new story quest game,negative
uninstalle notification application appear logo morning todays amazingbut reset devs check storage reinstall problem device kick need connection launch time ve normally friend happen try pop cache datum app delete work cause bug fix developer play update game,negative
audience deceive restriction excite form generally improvement major entire tired gacha voice original limit banner change improve artifact term great story dialogue time lot joke layout key customizable lack touchscreen problem eye seizure reason combat veiw camerasomething properly enjoy audio excellent exploration animation qol fix bad weapon good constantly experience year play character music game,negative
audience deceive restriction excite form generally improvement major entire tired gacha voice original limit banner change improve artifact term great story dialogue time lot joke layout key customizable lack touchscreen problem eye seizure reason combat veiw camerasomething properly enjoy audio excellent exploration animation qol fix bad weapon good constantly experience year play character music game,negative
disjoint voiceover english language resolve enjoyable usually recent annoying speak especially great want issue update joke layout key customizable lack touchscreen problem eye seizure reason combat veiw camerasomething properly enjoy audio excellent exploration animation qol fix bad weapon good constantly experience year play character music game,negative
treat fetch drastically early glare gacha let content fall quickly pc repetitive month pretty repeat story phone like paimon dialogue time space issue lot quest think joke layout key customizable lack touchscreen problem eye seizure reason combat veiw camerasomething properly enjoy audio excellent exploration animation qol fix bad weapon good constantly experience year play character music game,negative
interference party rd io release absurd literally mobile thing bad hard wild platform android provide user droid support needy original period probably gatcha limitation expensive limit banner passover battle purchase pc google oct fun save friend point overall wish long grind use end controller like time play update character week game,negative
redownloade tired atp join tartaglia fact rerun actually problem style bad feel good quit year think user droid support needy original period probably gatcha limitation expensive limit banner passover battle purchase pc google oct fun save friend point overall wish long grind use end controller like time play update character week game,negative
