rating,snippet,likes,rating_label,cleaned_snippet,review
1.0,"Its alright, you can get the game, only thing is you have to DELETE ALMOST ALL YOUR APPS. And even after that it tells you ""sorry you don't have enough space"" when in the game downloading. If it does that for most people, then whats the point in having it on the app store for certain devices???? Or maybe FIX YOUR GAME. It shouldn't take up that much space, especially for a phone.",269.0,negative,its alright you can get the game only thing is you have to delete almost all your apps and even after that it tells you sorry you dont have enough space when in the game downloading if it does that for most people then whats the point in having it on the app store for certain devices or maybe fix your game it shouldnt take up that much space especially for a phone,
2.0,"There is a bug that's causing the game to not work. I deleted all app data and cache data. Now the pop up says try updating the game after the developers fix it. This is only happening to me, my friends can still play the game normally.",1.0,negative,there is a bug thats causing the game to not work i deleted all app data and cache data now the pop up says try updating the game after the developers fix it this is only happening to me my friends can still play the game normally,
4.0,"I really enjoyed the game, and had it for like two weeks. I left it alone for three days and my entire save was wiped and I was reset to the beginning. I ended up re-downloading it and it's worked fine so far",1.0,positive,i really enjoyed the game and had it for like two weeks i left it alone for three days and my entire save was wiped and i was reset to the beginning i ended up redownloading it and its worked fine so far,
4.0,"Its a great game but, the buttons malfunctions somethimes, for example no matter how long or how hard you hold the attack button on mobile it doesnt do a heavy attack, which is a problem when doing arlecchino weekly boss, buttons cannot be moved so i am forced to play uncomfortably for 2 years.",0.0,positive,its a great game but the buttons malfunctions somethimes for example no matter how long or how hard you hold the attack button on mobile it doesnt do a heavy attack which is a problem when doing arlecchino weekly boss buttons cannot be moved so i am forced to play uncomfortably for years,
2.0,game is very slow and not fun after reaching Adventure rank 55 or above. There's not much to do except character building after reaching a curtain point in game. Please give us an endless mode for endgame. And hopefully a skip button for dialogue because its too slow.,19.0,negative,game is very slow and not fun after reaching adventure rank or above theres not much to do except character building after reaching a curtain point in game please give us an endless mode for endgame and hopefully a skip button for dialogue because its too slow,
4.0,It's amazing but it keeps kicking me out of the game and I keep trying to get up to the Jade chamber to grab the paper of snow because I went to checkpoint unlocking it and left the game but when I went back in the game the checkpoint wasn't saved and I've been trying to get up to the Jade chamber.,0.0,positive,its amazing but it keeps kicking me out of the game and i keep trying to get up to the jade chamber to grab the paper of snow because i went to checkpoint unlocking it and left the game but when i went back in the game the checkpoint wasnt saved and ive been trying to get up to the jade chamber,
5.0,I have been playing genshin for almost a year now and I like the quests very much. it helped me understand the concept of the game and the character designs are very amazing but I don't get why other players get mad for the designs. I hope you keep this up! I'll give 5 stars,0.0,positive,i have been playing genshin for almost a year now and i like the quests very much it helped me understand the concept of the game and the character designs are very amazing but i dont get why other players get mad for the designs i hope you keep this up ill give stars,
4.0,"Incredible game with amazing charachters, story, exploration, and combat. The only problem is the ungodly amounts of storage it takes up, like 30gb, it's insane. And the gatcha is an absolute scam.",0.0,positive,incredible game with amazing charachters story exploration and combat the only problem is the ungodly amounts of storage it takes up like gb its insane and the gatcha is an absolute scam,
4.0,"Only four stars due to lack of controller support on Android. Unless something has changed since I last played, and the lack of controller support is what made me stop playing. I'm bored enough to play without my controller but I hope you guys consider adding this sometime soon.",7.0,positive,only four stars due to lack of controller support on android unless something has changed since i last played and the lack of controller support is what made me stop playing im bored enough to play without my controller but i hope you guys consider adding this sometime soon,
5.0,"This is favourite game so far, I play this game for hours now, and the game graphics are dam good,I like the animations.And the characters are pretty good! The events are also good rules can be understood. No matter what we will support Genshin Impact 🤭",0.0,positive,this is favourite game so far i play this game for hours now and the game graphics are dam goodi like the animationsand the characters are pretty good the events are also good rules can be understood no matter what we will support genshin impact,
4.0,"My ping is so bad 260ms+ Edit: Maybe it was just a bad connection on my part. But now the ping is sometime 100ms down, but the LAG, the lag is still there. The game sometimes crashes when it's a cutscene and the music/dialogues would be choppy to the point wher I just decided to turn the volume off completely. (Edit:10/29/24 so, I contacted them months ago, and they have surprisingly fixed the issue— thou i also contacted my network provdr, now my game is running smoothly but stll lags smtimes",17.0,positive,my ping is so bad ms edit maybe it was just a bad connection on my part but now the ping is sometime ms down but the lag the lag is still there the game sometimes crashes when its a cutscene and the musicdialogues would be choppy to the point wher i just decided to turn the volume off completely edit so i contacted them months ago and they have surprisingly fixed the issue thou i also contacted my network provdr now my game is running smoothly but stll lags smtimes,
5.0,"Genshin Impact is a really fun game that has a lot of places to go to, amazing new hero's, high quality graphics and an breathtaking story. Genshin is an online game that you can play with other people like friends and siblings (if you have any🥲)... You need to defeat all of the villains to save your sister/brother by meeting new hero's and you can upgrade your hero's by collecting resources all across to map. Download Genshin Impact now to know all of the fascinating story's untold😉",0.0,positive,genshin impact is a really fun game that has a lot of places to go to amazing new heros high quality graphics and an breathtaking story genshin is an online game that you can play with other people like friends and siblings if you have any you need to defeat all of the villains to save your sisterbrother by meeting new heros and you can upgrade your heros by collecting resources all across to map download genshin impact now to know all of the fascinating storys untold,
2.0,The game is too heavy for low end devices ... Please do something otherwise I won't be able to play it anymore.. Edit: After the update it has gotten a lot slower even with a strong device I'm unable to enjoy the game so i would request the developers to think about the size of this game and do something about it,3.0,negative,the game is too heavy for low end devices please do something otherwise i wont be able to play it anymore edit after the update it has gotten a lot slower even with a strong device im unable to enjoy the game so i would request the developers to think about the size of this game and do something about it,
4.0,"The graphics are pretty good, I like the story and it's lore very much. It would be great if you guys put 5 star character interaction on the respective nation like those 4 stars outside of AQ.The mc not showcasing or using his powers are pretty much boring when compared to wuwa..",0.0,positive,the graphics are pretty good i like the story and its lore very much it would be great if you guys put star character interaction on the respective nation like those stars outside of aqthe mc not showcasing or using his powers are pretty much boring when compared to wuwa,
5.0,"This is by far one of the best games I've ever played. The lore is fantastic, the character designs look so cool too. Even the graphics are great. The storyline is amazing as well, considering its mainly why I play. This game is truly one of the best, hands down. Hoyoverse did a fantastic job with Genshin Impact. Edit : finally takes up less space THANK U MIHOYO",2.0,positive,this is by far one of the best games ive ever played the lore is fantastic the character designs look so cool too even the graphics are great the storyline is amazing as well considering its mainly why i play this game is truly one of the best hands down hoyoverse did a fantastic job with genshin impact edit finally takes up less space thank u mihoyo,
5.0,"I love Genshin. It's my favorite game ever. The graphics are amazing, and so are the characters. I love the details in every characters outfit and in the quests. I highly recommend playing this amazing game. (Also can Hu Tao pretty please get a new skin🙏🙏)",3.0,positive,i love genshin its my favorite game ever the graphics are amazing and so are the characters i love the details in every characters outfit and in the quests i highly recommend playing this amazing game also can hu tao pretty please get a new skin,
3.0,"Events need to be replayable. The En VA strike left the previous event voiceless and was unable to enjoy said content in my native language. When or if the strike ends, the content should be replayable. If not & the strike doesn't end, please seek new VAs.",1.0,positive,events need to be replayable the en va strike left the previous event voiceless and was unable to enjoy said content in my native language when or if the strike ends the content should be replayable if not the strike doesnt end please seek new vas,
1.0,"I take back what I said, worst game ever, too much dialogues, can't skip it, taking so long in the cutscene, a game is meant to be involving the player to actually play the game, not just reading or listening to dialogues all the time, if the quest makes us fight or having an actual interaction while having dialogues, that would be great, but most of the time people just keep tapping cause how boring and long the dialogues are, the dev doesn't listen to the players as well, not worth anymore",42.0,negative,i take back what i said worst game ever too much dialogues cant skip it taking so long in the cutscene a game is meant to be involving the player to actually play the game not just reading or listening to dialogues all the time if the quest makes us fight or having an actual interaction while having dialogues that would be great but most of the time people just keep tapping cause how boring and long the dialogues are the dev doesnt listen to the players as well not worth anymore,
5.0,"I have been playing this game for almost 4 years now, everything is azaming 🔥 osts, battle theme, lore, characters design, unique Playstyle and open world here is like can't be explained in words it's like real experience I haven't felt in any other game before, and hats off to all developers who did such a great work of art and present it to us, I can say they really did put lot of efforts into this game, i am really exciting to see where this journey will take us in future. Thank you all ❤",18.0,positive,i have been playing this game for almost years now everything is azaming osts battle theme lore characters design unique playstyle and open world here is like cant be explained in words its like real experience i havent felt in any other game before and hats off to all developers who did such a great work of art and present it to us i can say they really did put lot of efforts into this game i am really exciting to see where this journey will take us in future thank you all,
5.0,"Seen this game for a while, but never tried it. Finally playing this. As a gamer who is very fond of open world rpg games, This game is truly the best open world experience for me on mobile devices. Game looks too damn beautiful, they really did a great job on this one which made me very impressed. Definitely recommended to everyone who hasn't played it yet. Not giving it a try means you are really missing something great. Thanks to everyone who worked hard to create this masterpiece.",1.0,positive,seen this game for a while but never tried it finally playing this as a gamer who is very fond of open world rpg games this game is truly the best open world experience for me on mobile devices game looks too damn beautiful they really did a great job on this one which made me very impressed definitely recommended to everyone who hasnt played it yet not giving it a try means you are really missing something great thanks to everyone who worked hard to create this masterpiece,
4.0,I love the game so far however I'd like a option to automatically clear the new character stuff but I like the gameplay tho the story is a bit competitive with requirements and without the missions theirs not alot of fun stuff that's non competitive to do I'm hoping u get more of that gacha currency for missions,0.0,positive,i love the game so far however id like a option to automatically clear the new character stuff but i like the gameplay tho the story is a bit competitive with requirements and without the missions theirs not alot of fun stuff thats non competitive to do im hoping u get more of that gacha currency for missions,
5.0,"I love the game so very much. But I'm afraid about those hackers that can ruin accounts. I really wanna suggest that once we obtain a 5 star weapons, we player could've able to use that weapon to use for upgrading other weapons or yet we can't dispose it. Because even though hackers may give the accounts back, they'll still ruin the accounts",0.0,positive,i love the game so very much but im afraid about those hackers that can ruin accounts i really wanna suggest that once we obtain a star weapons we player couldve able to use that weapon to use for upgrading other weapons or yet we cant dispose it because even though hackers may give the accounts back theyll still ruin the accounts,
5.0,"It's been a 3y i play this game everything it's good but this game isn't for low end device so don't try to install on low ram devices it's might harmful for your device anyway i like art style , explore the open world , collect charecter, story quest etc there many way to having fun",0.0,positive,its been a y i play this game everything its good but this game isnt for low end device so dont try to install on low ram devices its might harmful for your device anyway i like art style explore the open world collect charecter story quest etc there many way to having fun,
2.0,"Eversince the new update ive been getting too frequent crashes recently on Samsung A12 (4gb ram) Like any sudden movements, fighting enemies and other things made it freeze then crash and also freeze frames in random seconds even if the character isnt moving including just opening up the menu I already lowered my graphics and experiment it and none of it is suitable.",5.0,negative,eversince the new update ive been getting too frequent crashes recently on samsung a gb ram like any sudden movements fighting enemies and other things made it freeze then crash and also freeze frames in random seconds even if the character isnt moving including just opening up the menu i already lowered my graphics and experiment it and none of it is suitable,
2.0,"The game story wise is good , but Too boring for old player there nothing to do abyss is easy, that new end game mode its also ok , I have completed all the quest and now I have nothing to do, my daily routine now is just open the game do the boring commissions, use resin and close the game gonna uninstall it soon",3.0,negative,the game story wise is good but too boring for old player there nothing to do abyss is easy that new end game mode its also ok i have completed all the quest and now i have nothing to do my daily routine now is just open the game do the boring commissions use resin and close the game gonna uninstall it soon,
2.0,"I want you to add a controller for this game, you are one separate company with apple product why would you not provide an android controller, most of the players are playing with android, you can calculate the ratio through download platforms. It is hardly difficult. You had ps4 to be compatibility yet can't do with android. You first launch in android but never had any controller to be the first one.",0.0,negative,i want you to add a controller for this game you are one separate company with apple product why would you not provide an android controller most of the players are playing with android you can calculate the ratio through download platforms it is hardly difficult you had ps to be compatibility yet cant do with android you first launch in android but never had any controller to be the first one,
1.0,"Still no skip button, which is just absurd at this point, and all these characters do is talk talk talk, sometimes it's interesting, sometimes it takes up too much time and can be said in way more shorter sentences. This game just really gets on my nerves sometimes.",36.0,negative,still no skip button which is just absurd at this point and all these characters do is talk talk talk sometimes its interesting sometimes it takes up too much time and can be said in way more shorter sentences this game just really gets on my nerves sometimes,
5.0,"I just always find myself coming back to the game. I've been playing around 2020, so Im a pretty veteran player. I love story line and combat. Though I do wish that hoyo would be more diverse when it comes to the skin color of the characters.",0.0,positive,i just always find myself coming back to the game ive been playing around so im a pretty veteran player i love story line and combat though i do wish that hoyo would be more diverse when it comes to the skin color of the characters,
2.0,"It's awesome! Don't mind the low in game rewards or the odd fandom. There is one huge problem that includes co - op and the teapot realm.I am currently using a phone,and when I build in my teapot,I press save afterwards.Then,it says for me to wait.To wait for the furniture to load in.EXCEPT..IT NEVER GOES AWAY!Which doesn't allow other travelers to visit my sweet,hard worked, mini games that I put in my realm.I waited for hours,and actually my wifi and the weather is completely fine!",0.0,negative,its awesome dont mind the low in game rewards or the odd fandom there is one huge problem that includes co op and the teapot realmi am currently using a phoneand when i build in my teapoti press save afterwardsthenit says for me to waitto wait for the furniture to load inexceptit never goes awaywhich doesnt allow other travelers to visit my sweethard worked mini games that i put in my realmi waited for hoursand actually my wifi and the weather is completely fine,
4.0,"My one gripe is the actual lack of skins for the surplus of characters. It just feels kind of lazy honestly, they release like one or two in an entire year unless its a major event like the lantern rite. Doesn't help that using mods for skins will end up getting you banned, so you're restricted to their like 15 skins compared to the total number of 79 characters. And usually they're for the most irrelevant characters like...",3.0,positive,my one gripe is the actual lack of skins for the surplus of characters it just feels kind of lazy honestly they release like one or two in an entire year unless its a major event like the lantern rite doesnt help that using mods for skins will end up getting you banned so youre restricted to their like skins compared to the total number of characters and usually theyre for the most irrelevant characters like,
3.0,"I really love the game, the story and everything but there's one thing I'm disappointed, the story of Birthday of nahida, some characters don't have a voice when they speak so i need to read what they're talking to and it's disappointing because some characters have a voice and the other have not. So when they have conversation, it's kinda annoying. Please fixed these immediately so i can appreciate the story of these game more.",2.0,positive,i really love the game the story and everything but theres one thing im disappointed the story of birthday of nahida some characters dont have a voice when they speak so i need to read what theyre talking to and its disappointing because some characters have a voice and the other have not so when they have conversation its kinda annoying please fixed these immediately so i can appreciate the story of these game more,
1.0,Thanks for fixing the game buut every time I go somewhere there's a quest and when you have too many you can't play the real story can you please add like a button so that you don't need to do the other quests also when you try to buy some things with your card it doesn't work even if it does it doesn't give you the things you brought,7.0,negative,thanks for fixing the game buut every time i go somewhere theres a quest and when you have too many you cant play the real story can you please add like a button so that you dont need to do the other quests also when you try to buy some things with your card it doesnt work even if it does it doesnt give you the things you brought,
5.0,"Wow... this is great game. I played this game almost a year and I am still enjoying it. If you like open world and free game, this is the game for you. I played 6 month free then I buy only $5 monthly welkin. I wish I bought it sooner since most cost effective deal. I think mihoyo should allow new users able to buy 2 or 3 month previous month welkin, when making first purchase. I thought it was Korean game because voice actor were so good. If you like open world game, this game is worth to try.",0.0,positive,wow this is great game i played this game almost a year and i am still enjoying it if you like open world and free game this is the game for you i played month free then i buy only monthly welkin i wish i bought it sooner since most cost effective deal i think mihoyo should allow new users able to buy or month previous month welkin when making first purchase i thought it was korean game because voice actor were so good if you like open world game this game is worth to try,
3.0,The game itself is very good but it lacks i control we do not have full control overy our character because it is deficult to execute proper combo sometimes we miss click etc. we hope you'll add controller support to android and ios too So that we can have a better experience handling character,0.0,positive,the game itself is very good but it lacks i control we do not have full control overy our character because it is deficult to execute proper combo sometimes we miss click etc we hope youll add controller support to android and ios too so that we can have a better experience handling character,
2.0,"When I did the update of the game, I lost my account, and now im not able to log in. It's been 2 weeks since I updated the game, and i'm still trying to get in, and when I send an email to Genshin, no one responds to me. I have been playing for 2 years and had 3k dollars on the account, and now everything is gone, I recommend you 1. Don't buy anything on the game, and 2. Don't waste your time here",2.0,negative,when i did the update of the game i lost my account and now im not able to log in its been weeks since i updated the game and im still trying to get in and when i send an email to genshin no one responds to me i have been playing for years and had k dollars on the account and now everything is gone i recommend you dont buy anything on the game and dont waste your time here,
5.0,"Worth it! 👍 Update: so I played this on my potato phone for long, from mondstadt to Fontaine and worked total fine, and it still does exspect natlan it crash soo much just entering their it carshs but still play the other religions smooth ,natlan is demanding. Am just stack until I get some expensive medium to play",0.0,positive,worth it update so i played this on my potato phone for long from mondstadt to fontaine and worked total fine and it still does exspect natlan it crash soo much just entering their it carshs but still play the other religions smooth natlan is demanding am just stack until i get some expensive medium to play,
4.0,"I believe there should be better rewards, and if possible, please consider reducing the pity rate from 90 to around 70 for free-to-play players. As a fan of Eula, it feels like a long wait to get her. Since I was playing from the beginning overall best game 🙂",1.0,positive,i believe there should be better rewards and if possible please consider reducing the pity rate from to around for freetoplay players as a fan of eula it feels like a long wait to get her since i was playing from the beginning overall best game,
