rating,snippet,likes,rating_label,cleaned_snippet,review
3.0,"While I've reviewed this before, I decided to edit my response to my current opinion. The game is great, the graphics are stunning, and the stories are nice. However, it's very long and excessive. It makes it feel more like a chore. As you get more into the end game, getting rewards is a struggle, and farming and upgrading characters is more of a hassle than it should be. The resin (energy) cap should be upgraded, or costs of energy should be lowered. This game is very good, just time consuming.",88.0,positive,while ive reviewed this before i decided to edit my response to my current opinion the game is great the graphics are stunning and the stories are nice however its very long and excessive it makes it feel more like a chore as you get more into the end game getting rewards is a struggle and farming and upgrading characters is more of a hassle than it should be the resin energy cap should be upgraded or costs of energy should be lowered this game is very good just time consuming,
3.0,Very fun but I wish there was more fighting in the quests. It's just a bunch of talking and running around when it comes to the quests that just make me want to leave the game. It brings me in with the potential for awesome battles but then turns me off with all the dialogue that you can't skip. Has a lot of potential. At leave give us the ability to SKIP the dialogue.,35.0,positive,very fun but i wish there was more fighting in the quests its just a bunch of talking and running around when it comes to the quests that just make me want to leave the game it brings me in with the potential for awesome battles but then turns me off with all the dialogue that you cant skip has a lot of potential at leave give us the ability to skip the dialogue,
3.0,"Fun game, I enjoy the story. There is tons to do and tons of content to clear, so if you're bored, pick it up! The problem with it, however, is the long time between character reruns. It has been over a year since some characters are available and it is really killing enjoyment for a lot of people when they aren't able to get their favorites.",11.0,positive,fun game i enjoy the story there is tons to do and tons of content to clear so if youre bored pick it up the problem with it however is the long time between character reruns it has been over a year since some characters are available and it is really killing enjoyment for a lot of people when they arent able to get their favorites,
5.0,"This game is phenomenal. The art style and scenery are stunning. Yes, the game is long, but that's why it's fun. It takes you on several journeys and gives you memories worth remembering. The combat is fun as well, and the devs are working on storage control for those having issues with game size. I would ignore all those hateful/spam reviews as it's mostly just bots or people trying to ruin the joy for others.",77.0,positive,this game is phenomenal the art style and scenery are stunning yes the game is long but thats why its fun it takes you on several journeys and gives you memories worth remembering the combat is fun as well and the devs are working on storage control for those having issues with game size i would ignore all those hatefulspam reviews as its mostly just bots or people trying to ruin the joy for others,
2.0,"I love this game. However, it is incredibly laggy to the point where it's unplayable. I have all the graphics on the lowest setting, including the FPS, and yet it still somehow manages to crash. It isn't my storage because I have lots of it to the point where Genshin barely makes a dent in it, and it isn't my wifi because it runs smoothly for all the other apps. Please fix this and optimize it better for mobile players.",14.0,negative,i love this game however it is incredibly laggy to the point where its unplayable i have all the graphics on the lowest setting including the fps and yet it still somehow manages to crash it isnt my storage because i have lots of it to the point where genshin barely makes a dent in it and it isnt my wifi because it runs smoothly for all the other apps please fix this and optimize it better for mobile players,
3.0,I used to be obsessed with this game but I haven't played it in months because of how boring and repetitive the gameplay has gotten. The developers also don't care very much about player feedback and seem to pick and choose what feedback they use to incorporate into quality of life changes. Speaking of which it took them 4 years to implement some QoL changes that have been requested for years. A shame but Genshin Impact's dev team needs to do better.,99.0,positive,i used to be obsessed with this game but i havent played it in months because of how boring and repetitive the gameplay has gotten the developers also dont care very much about player feedback and seem to pick and choose what feedback they use to incorporate into quality of life changes speaking of which it took them years to implement some qol changes that have been requested for years a shame but genshin impacts dev team needs to do better,
5.0,"Highly recommend. I have been playing the game since last year (2023) and have been very impressed with the mechanics and captivated by the storyline. Constant updates keep the game interesting and ensure that the player stays engaged. Lore is impressive. Graphics are great during gameplay, and ABSOLUTELY AWESOME during cutscenes, especially since 5.0 update. Very very impressed. Have reccomended to many of my friends and all have enjoyed and are still playing the game till this day.",65.0,positive,highly recommend i have been playing the game since last year and have been very impressed with the mechanics and captivated by the storyline constant updates keep the game interesting and ensure that the player stays engaged lore is impressive graphics are great during gameplay and absolutely awesome during cutscenes especially since update very very impressed have reccomended to many of my friends and all have enjoyed and are still playing the game till this day,
4.0,"Hello! I absolutely love this game! It has incredible graphics and is a ton of fun to play. But, lately, whenever I try to open it, it says that the game has a bug and kicks me out before I even get to the loading screen. It says the developer needs to fix the issue before the game can be opened. Please fix this issue! I love you game, I always look forward to playing at the end of my day. Thank you!",29.0,positive,hello i absolutely love this game it has incredible graphics and is a ton of fun to play but lately whenever i try to open it it says that the game has a bug and kicks me out before i even get to the loading screen it says the developer needs to fix the issue before the game can be opened please fix this issue i love you game i always look forward to playing at the end of my day thank you,
4.0,"I've been playing this game since January 16th, 2022. I have no real complaints.. The style is nice, not TOO much fan service, The characters are all interesting in their own ways, and there's soooooo much more that's gonna be added to the game not making it boring!! I have an OLD phone (Samsung Galaxy s10e) and it still runs smoothly, sometimes it'll glitch but not as bad as my pc since my pc was running on it's last bits of life... It exploded while I was playing this game... 😞",64.0,positive,ive been playing this game since january th i have no real complaints the style is nice not too much fan service the characters are all interesting in their own ways and theres soooooo much more thats gonna be added to the game not making it boring i have an old phone samsung galaxy se and it still runs smoothly sometimes itll glitch but not as bad as my pc since my pc was running on its last bits of life it exploded while i was playing this game,
1.0,"Uninteresting characters, uninteresting dialog, a story with potential that isn't told very well. It has been 5 years and the games story isn't complete, I would have rather they not relesed it until there was more.It gets boring very quickly, usually in other open world adventures games, I find myself exploring the gorgeous open world for hours, engrossed in the story and, enjoying well written characters, yet this game can deliver in none of those things.",14.0,negative,uninteresting characters uninteresting dialog a story with potential that isnt told very well it has been years and the games story isnt complete i would have rather they not relesed it until there was moreit gets boring very quickly usually in other open world adventures games i find myself exploring the gorgeous open world for hours engrossed in the story and enjoying well written characters yet this game can deliver in none of those things,
4.0,"Amazing game. It's beautiful, the character design is amazing, and there's so much to do. That being said, I have had some recent issues with the game crashing, often when I'm not doing anything I'd think would make it crash. It's crashed when I'm just wandering around, in the middle of dialog, and once right after I had completed a domain, forcing me to redo it. I used the compatibility mode so it would run smoother, but that didn't help with it crashing.",110.0,positive,amazing game its beautiful the character design is amazing and theres so much to do that being said i have had some recent issues with the game crashing often when im not doing anything id think would make it crash its crashed when im just wandering around in the middle of dialog and once right after i had completed a domain forcing me to redo it i used the compatibility mode so it would run smoother but that didnt help with it crashing,
5.0,"Love the game! But a couple issues. One, it takes up sooooo much space on my phone. Two, it is so hard to get any other characters than the storyline ones. It is an amazing game and I would definitely recommend 😁 ❤️ Edit: ok. I'm back. I've gotten so many new characters. My friend taught me how to use the wish system hehe... also I've only gotten to the geo archon quest but fontaine is a beautiful city. I can't wait for the new update. One thing. Mobile is glitchy. I understand why though.",644.0,positive,love the game but a couple issues one it takes up sooooo much space on my phone two it is so hard to get any other characters than the storyline ones it is an amazing game and i would definitely recommend edit ok im back ive gotten so many new characters my friend taught me how to use the wish system hehe also ive only gotten to the geo archon quest but fontaine is a beautiful city i cant wait for the new update one thing mobile is glitchy i understand why though,
5.0,"Initially, I had a 5-star review. I can no longer keep that review anymore in good faith. I love the art style of the game, the music is amazing, and the world itself is very beautiful. A few months ago, I finished the main story. When this new patch update dropped, the main story was finished really quickly, same with the character story quest. This game just seems to have gotten stagnet. Things we have been asking for have been put into HSR instead. Personally it's annoying. Show us some love",665.0,positive,initially i had a star review i can no longer keep that review anymore in good faith i love the art style of the game the music is amazing and the world itself is very beautiful a few months ago i finished the main story when this new patch update dropped the main story was finished really quickly same with the character story quest this game just seems to have gotten stagnet things we have been asking for have been put into hsr instead personally its annoying show us some love,
5.0,"It's one of the few mobile phone games I play, I just started playing, and honestly, it's the most fun I've had in a game for a long time. I'm glad I got it. It also supports external storage on devices that allow for external memory sticks to be inserted into them. Thr game has an ""optimized"" feature in the graphics section of the games Options Menu. It'll analyze your device and automatically adjust the game to run as smoothly as possible for said device. It's very nice!",432.0,positive,its one of the few mobile phone games i play i just started playing and honestly its the most fun ive had in a game for a long time im glad i got it it also supports external storage on devices that allow for external memory sticks to be inserted into them thr game has an optimized feature in the graphics section of the games options menu itll analyze your device and automatically adjust the game to run as smoothly as possible for said device its very nice,
3.0,"Been playing since Sep 2020. The game is beautiful. I love the different nations, character designs, the undtrack is top-tier, and I really enjoy the world exploration, puzzles, and battle. It was difficult for me to leave such review, but the current state of the game has left me pretty much disappointed and frustrated. Late-game content is dull, monotonous and tedious, and the so-called ""rewards"" are insulting, measly, and just plain stingy, even for a gatcha game. Please do better. 💔",212.0,positive,been playing since sep the game is beautiful i love the different nations character designs the undtrack is toptier and i really enjoy the world exploration puzzles and battle it was difficult for me to leave such review but the current state of the game has left me pretty much disappointed and frustrated lategame content is dull monotonous and tedious and the socalled rewards are insulting measly and just plain stingy even for a gatcha game please do better,
5.0,"This is an awesome game! The main story and side quests are extremely well-written and immersive, all the countries are well designed and have many enjoyable puzzles to unlock various rewards, and the elemental fighting system is really unique and fun. With a few exceptions, all the characters are beautifully designed, and it's fairly easy to get enough resources to obtain them. I highly recommend this!",412.0,positive,this is an awesome game the main story and side quests are extremely wellwritten and immersive all the countries are well designed and have many enjoyable puzzles to unlock various rewards and the elemental fighting system is really unique and fun with a few exceptions all the characters are beautifully designed and its fairly easy to get enough resources to obtain them i highly recommend this,
5.0,"There is so much to do in this game as long as you do certain quest, its like a rollercoaster with high, lots of quest to lows. The harder it gets, the higher level you get. Definitely can cost money if you want to wish for more characters or special weapons or purchase special items. However, it uses a lot of memory. If it gets sluggish, then you don't have enough memory! Also, later on, if you don't build your characters correctly, you will have a difficult time, repetitive farming battles.",337.0,positive,there is so much to do in this game as long as you do certain quest its like a rollercoaster with high lots of quest to lows the harder it gets the higher level you get definitely can cost money if you want to wish for more characters or special weapons or purchase special items however it uses a lot of memory if it gets sluggish then you dont have enough memory also later on if you dont build your characters correctly you will have a difficult time repetitive farming battles,
5.0,"I've played this game for about 3 or 4 years, only a little after its release, and it's been pretty fun, I like some aspects of the game, like the lore, gameplay, characters, but overtime I feel like the events and story have been getting boring or repetitive. Especially recently, I've also been getting disappointed with new character designs, like Emilie, The Natlan characters, Sethos.. they just don't feel as special to me as the older ones do. Then again end game experience isn't that great",1301.0,positive,ive played this game for about or years only a little after its release and its been pretty fun i like some aspects of the game like the lore gameplay characters but overtime i feel like the events and story have been getting boring or repetitive especially recently ive also been getting disappointed with new character designs like emilie the natlan characters sethos they just dont feel as special to me as the older ones do then again end game experience isnt that great,
3.0,"I feel like this game would be a lot more fun, if it didn't use as much as it did. It eats up my battery, my storage, my wifi, and so much more, when it doesn't even load a lot of the time. I understand it's a big game and that it needs a lot of resources to function, but doing all of that and still crashing every single time is ridiculous. Any time I actually am able to play it, it's amazing, but I'm seriously thinking about giving up on Genshin.",11.0,positive,i feel like this game would be a lot more fun if it didnt use as much as it did it eats up my battery my storage my wifi and so much more when it doesnt even load a lot of the time i understand its a big game and that it needs a lot of resources to function but doing all of that and still crashing every single time is ridiculous any time i actually am able to play it its amazing but im seriously thinking about giving up on genshin,
4.0,"A lot to do in a massive open world, variety of characters and elemental powers with multiple weapons including mages. Its a long term game. Downside its insanely difficult to get artifacts to equip characters with the stats you are looking for plus in a single run to farm them it has two different types of artifacts instead of one which makes it even harder. You'll spend lot of Resin (energy) to get barely or exactly what you want just to build a single character. Developers should improve this",434.0,positive,a lot to do in a massive open world variety of characters and elemental powers with multiple weapons including mages its a long term game downside its insanely difficult to get artifacts to equip characters with the stats you are looking for plus in a single run to farm them it has two different types of artifacts instead of one which makes it even harder youll spend lot of resin energy to get barely or exactly what you want just to build a single character developers should improve this,
1.0,"I really liked this game. The early game story was fun, and I liked the older characters. But there are a ton of issues that the players continue to bring up that fall on deaf ears. The later game play doesn't even scale up the exp of the random bad guys you run into on the map as your world level increases, so it's much more difficult to level up your characters in later gameplay. Along with random bugs and things, they just refuse to fix. Needles to say, I won't be re-downloading this one.",1282.0,negative,i really liked this game the early game story was fun and i liked the older characters but there are a ton of issues that the players continue to bring up that fall on deaf ears the later game play doesnt even scale up the exp of the random bad guys you run into on the map as your world level increases so its much more difficult to level up your characters in later gameplay along with random bugs and things they just refuse to fix needles to say i wont be redownloading this one,
3.0,"Two stars docked because of personal opinions that most people in the reviews have already addressed (poor recent character designs, slow story). I just wish there was an option that let us pick which commissions we want after we reach the max reputation in a nation (at least). It's so annoying trying to get certain ones that unlock some sort of storyline for an achievement. It would be cool if we could just interact with the commission board ourselves and pick it out.",14.0,positive,two stars docked because of personal opinions that most people in the reviews have already addressed poor recent character designs slow story i just wish there was an option that let us pick which commissions we want after we reach the max reputation in a nation at least its so annoying trying to get certain ones that unlock some sort of storyline for an achievement it would be cool if we could just interact with the commission board ourselves and pick it out,
4.0,"It's a pretty good game, good graphics, cool designs for characters, nice storyline and voice acting. You can freely explore the game but once you get to a high AR it gets quite boring...I would try and make it where you give like a permanent mini game. otherwise it's a great game",0.0,positive,its a pretty good game good graphics cool designs for characters nice storyline and voice acting you can freely explore the game but once you get to a high ar it gets quite boringi would try and make it where you give like a permanent mini game otherwise its a great game,
3.0,"This is a really great game and I do enjoy it a lot whenever I try to come in. I love to explore and accomplish the quests that come with the exploring. However, there are a few things that I noticed recently that has completely changed me thoughts. During the in game experience whenever I try to sign in, it tends to be VERY laggy and it crashed several times. Another thing I do want to point out is the fact that there isnt much fun updates or attention that is put to this game as the others.",256.0,positive,this is a really great game and i do enjoy it a lot whenever i try to come in i love to explore and accomplish the quests that come with the exploring however there are a few things that i noticed recently that has completely changed me thoughts during the in game experience whenever i try to sign in it tends to be very laggy and it crashed several times another thing i do want to point out is the fact that there isnt much fun updates or attention that is put to this game as the others,
5.0,"Genshin Impact is a visually satisfying, beautiful game. Controls are simple and the cross-platform experience is seamless. I can play on my console at home, my laptop when traveling, and pick up where I left off on my phone when I'm on the go, and all without spending a dime if I don't want to! This story is immersive, and always evolving, with new characters and adventures constantly being added. I'm just really impressed with every aspect of Genshin Impact, and can't recommend it enough!",170.0,positive,genshin impact is a visually satisfying beautiful game controls are simple and the crossplatform experience is seamless i can play on my console at home my laptop when traveling and pick up where i left off on my phone when im on the go and all without spending a dime if i dont want to this story is immersive and always evolving with new characters and adventures constantly being added im just really impressed with every aspect of genshin impact and cant recommend it enough,
4.0,"I love genshin and there Characters and story also exploration is fun , but the resin cap is very annoying as a ftp It makes building a character ten times longer and harder and sice genshin is so big now it makes it even harder to keep up. Also, the storage issues are getting really bad. Even if I delete past data but besides that, genshin is a beautiful game They fixed a lot of issues. yay :> still hate how much storge it is.",115.0,positive,i love genshin and there characters and story also exploration is fun but the resin cap is very annoying as a ftp it makes building a character ten times longer and harder and sice genshin is so big now it makes it even harder to keep up also the storage issues are getting really bad even if i delete past data but besides that genshin is a beautiful game they fixed a lot of issues yay still hate how much storge it is,
2.0,"On a strong mobile android, the fps and lag overlaps everything from even moving or hearing audio. It gets so severe that it's aggravating to deal with while playing every time. It turns completely unplayable. Editing the review because since the newest update 5.0 for Natlan, the game takes 5 minutes to even load a cutscene or walk an inch to somewhere. It even crashes the game entirely at the lowest graphic settings. This wasn't an issue until this update",41.0,negative,on a strong mobile android the fps and lag overlaps everything from even moving or hearing audio it gets so severe that its aggravating to deal with while playing every time it turns completely unplayable editing the review because since the newest update for natlan the game takes minutes to even load a cutscene or walk an inch to somewhere it even crashes the game entirely at the lowest graphic settings this wasnt an issue until this update,
5.0,"You've seen the adds, youtubers sponsoring this, the whole 9 yards. I am here to tell you after a few days of playing that the game is actually pretty good. It definitely fills that need to upgrade and slowly become stronger with equipment and characters. It also doesn't make the mistake of having high level enemies you can't possibly fight near the beginning, a common mistake many games make. It eases you in and slowly introduces more and more game mechanics as it should. For now I am hooked.",1280.0,positive,youve seen the adds youtubers sponsoring this the whole yards i am here to tell you after a few days of playing that the game is actually pretty good it definitely fills that need to upgrade and slowly become stronger with equipment and characters it also doesnt make the mistake of having high level enemies you cant possibly fight near the beginning a common mistake many games make it eases you in and slowly introduces more and more game mechanics as it should for now i am hooked,
