cleaned_snippet,rating_label
game amazing love main story free roam game problem play laptop game constantly crash game will not let login annoying try restart laptop fix game try reinstall work,positive
storyline awesome love play stop dialogue long not skip especially event quest conversation unnecessary boring game large phone game well pc console,positive
rate star issue need fix like try login account say request try later contact genshin support think hope fix soon possible badly miss account,positive
love game unconditionally player friendly map beautiful story line amazing think star game disappointing not great m ar m love plan good game etc badluck people bad review devs try satisfy guy ill play game matter give lovely game thankyou hoyoberse muahahahaeauheurys,positive
th anniversary weapon banner pitt radiance pity system free look like deserve long time update rating hope reward future rating improvement reduce weapon pity good anniversary elixir cost need easy obtain,positive
fun play not know m new player funn u guy download try explore vast world questgood graphic good story line long play want overall game fun like play game,positive
game get unreasonable hate people play highly recommend game amazing year play bulkier phone crash lag happen low graphic setting character story worth,positive
love game take way storage like gb way mobile game device dedicate genshin genshin s way hell damn world app like sorry ridiculous gb gb lot mobile game let story great character art get boring ve quest explore gacha not good tho,positive
controller support android year feedback give fall deaf ear s severe lack qol feature consider game age proper endgame content artifact loadout custom domain creator perfect endgame content alas temporary usual game good tonedeaf company actually use money improve billion dollar company people,negative
amazing game superb story line gameplay great mobile need decent phone run see comment game crash etc plus g run game like dream,positive
alright game thing delete app tell sorry not space game download people s point have app store certain device maybe fix game not space especially phone,negative
bug s cause game work delete app datum cache datum pop say try update game developer fix happen friend play game normally,negative
enjoy game like week leave day entire save wipe reset beginning end redownloade worked fine far,positive
great game button malfunction somethime example matter long hard hold attack button mobile not heavy attack problem arlecchino weekly boss button move force play uncomfortably year,positive
game slow fun reach adventure rank s character building reach curtain point game endless mode endgame hopefully skip button dialogue slow,negative
amazing keep kick game try jade chamber grab paper snow go checkpoint unlock leave game go game checkpoint not save ve try jade chamber,positive
play genshin year like quest help understand concept game character design amazing not player mad design hope ill star,positive
incredible game amazing charachter story exploration combat problem ungodly amount storage take like gb insane gatcha absolute scam,positive
star lack controller support android change play lack controller support stop play m bored play controller hope guy consider add soon,positive
favourite game far play game hour game graphic dam goodi like animationsand character pretty good event good rule understand matter support genshin impact,positive
ping bad ms edit maybe bad connection ping ms lag lag game crash cutscene musicdialogue choppy point wher decide turn volume completely edit contact month ago surprisingly fix issue thou contact network provdr game run smoothly stll lag smtime,positive
genshin impact fun game lot place amazing new hero high quality graphic breathtake story genshin online game play people like friend sibling need defeat villain save sisterbrother meet new hero upgrade hero collect resource map download genshin impact know fascinating story untold,positive
game heavy low end device will not able play anymore edit update get lot slow strong device m unable enjoy game request developer think size game,negative
graphic pretty good like story lore great guy star character interaction respective nation like star outside aqthe mc showcase power pretty boring compare wuwa,positive
far good game ve play lore fantastic character design look cool graphic great storyline amazing consider mainly play game truly good hand hoyoverse fantastic job genshin impact edit finally take space thank u mihoyo,positive
love genshin favorite game graphic amazing character love detail character outfit quest highly recommend play amazing game hu tao pretty new skin,positive
event need replayable en va strike leave previous event voiceless unable enjoy say content native language strike end content replayable strike not end seek new vas,positive
say bad game dialogue not skip take long cutscene game mean involve player actually play game read listen dialogue time quest make fight have actual interaction have dialogue great time people tap cause boring long dialogue dev not listen player worth anymore,negative
play game year azame ost battle theme lore character design unique playstyle open world like not explain word like real experience not feel game hat developer great work art present lot effort game exciting journey future thank,positive
see game try finally play gamer fond open world rpg game game truly good open world experience mobile device game look damn beautiful great job impressed definitely recommend not play give try mean miss great thank work hard create masterpiece,positive
love game far d like option automatically clear new character stuff like gameplay tho story bit competitive requirement mission theirs alot fun stuff s non competitive m hope u gacha currency mission,positive
love game m afraid hacker ruin account wanna suggest obtain star weapon player ve able use weapon use upgrade weapon not dispose hacker account ll ruin account,positive
y play game good game not low end device not try install low ram device harmful device like art style explore open world collect charecter story quest etc way have fun,positive
eversince new update ve get frequent crash recently samsung gb ram like sudden movement fight enemy thing freeze crash freeze frame random second character not move include open menu lower graphic experiment suitable,negative
game story wise good boring old player abyss easy new end game mode ok complete quest daily routine open game boring commission use resin close game go to uninstall soon,negative
want add controller game separate company apple product provide android controller player play android calculate ratio download platform hardly difficult ps compatibility not android launch android controller,negative
skip button absurd point character talk talk talk interesting take time say way short sentence game get nerve,negative
find come game ve play m pretty veteran player love story line combat wish hoyo diverse come skin color character,positive
awesome not mind low game reward odd fandom huge problem include co op teapot realmi currently phoneand build teapoti press save afterwardsthenit say waitto wait furniture load inexceptit go awaywhich not allow traveler visit sweethard work mini game realmi wait hoursand actually wifi weather completely fine,negative
gripe actual lack skin surplus character feel kind lazy honestly release like entire year major event like lantern rite not help mod skin end get ban restrict like skin compare total number character usually irrelevant character like,positive
love game story s thing m disappoint story birthday nahida character not voice speak need read talk disappointing character voice conversation kinda annoying fix immediately appreciate story game,positive
thank fix game buut time s quest not play real story add like button not need quest try buy thing card not work not thing bring,negative
wow great game play game year enjoy like open world free game game play month free buy monthly welkin wish buy soon cost effective deal think mihoyo allow new user able buy month previous month welkin make purchase think korean game voice actor good like open world game game worth try,positive
game good lack control control overy character deficult execute proper combo miss click etc hope ll add controller support android io well experience handle character,positive
update game lose account m able log week update game m try send email genshin respond play year k dollar account go recommend not buy game not waste time,negative
worth update play potato phone long mondstadt fontaine work total fine exspect natlan crash soo enter carshs play religion smooth natlan demand stack expensive medium play,positive
believe well reward possible consider reduce pity rate freetoplay player fan eula feel like long wait play begin overall good game,positive
game pretty good place character quest interesting will not quit game bug weird play genshin impact day normal quest start know npc character voice line miss fix bug pls love genshin impact,positive
game nice good graphic fact need gb datum play insane amazed datum mobile game play android game like asphalt gangstar vegas game ask extreme datum download requirement,positive
ve play year star time sooooo disappointing hour gameplay event achievement go progress not star rating want,negative
play problem happen problem game take space kick app reason tho admit graphic plot story good pretty good game consider laggy,positive
update gi offer incredible openworld recent story strong daily system improve reward engagement quest make easy use resin reward game big flaw continue painfully slow character building process story pacing prevent fast reader bore event content quickly dialogue skip qol think gi continue great title,positive
good game play phone worth bit storage take phone good story graphic quest character think download game thing regret download game good character standard character gaming experience notch,positive
ok get bit well release shall quality improve quality great especially competitor market content feel stale need endgame activity weekly reward allow chance favourite character like certain weekly exploration abyss activity sort like hoyo game own,positive
not understand people hate game ve play game patch s time suppose people follow like sheep game nice chance ve play long improve update listen fandom time game s like exploration coop main story cook visual novel,positive
play game beginning good ve play story character good combat super fun game exhausting spend hour save currency character wish reward,positive
notice lot star review decide star think game great getting bore simply break like story world game music unreal casual player appreciate get stuff hard thank make game,positive
blast play genshin gorgeous graphic entice storyline love aspect game suggest skip dialogue button story memorize point highly recommend game casual hardcore gamer recommend game gam creator like honkai star rail extremely fun entertaining game,positive
love game fun story quest love game scenery character small issue lag mobile user understandable good game ve play deserve star rating help people understand thing real life recommend play,positive
s insane boring dialogue not skip add skip button seriously literal gameplay min dialogue min listen boring talk tap screen life skip dialogue add skip button,negative
finally hoyo start listen player lot qol change focus have fun spend time repetitive nonsense like daily abyss run short afford generous freebie consider game make deserve star fun natlan far qol change not screw thing,positive
tho play yrs old budget phone game beautiful now loading kinda fast new update love change suddenly app get crash little time try reinstall result focus low end device like give opt change rendering distance smth like,positive
game pretty good downside big game load hard fp player currency game game beautiful interesting deep plot wish little easy overall,positive
easy story character puzzle sooo good thing hate lack free reward compare game game feel soo dry lazy player like force grind character want community good player toxic,positive
update oct not use google point pc purchase battle passover update save wish week not banner character game overall fun limit grind character wish expensive limitation gatcha game probably friend end play long period time original like needy controller support droid user,negative
dear hoyoverse enjoy game fun lot puzzle deal mention boss enemy love character story hope mic party talk texte friend fun speak friend game,positive
play game release multiple device edit game multiple time game amazing open world amazing character black character not skin color light tone npc yes game good fix character actually need melanin,positive
time addict game like perfeeect quality game character music view quest world animation literally awesome highly highly recommend game d,positive
bad experience old phone z fold amazing usually play pc phone wish file phone allow change controll use wireless keyboard mouse fold fun accept control currently not recognize available control game reason try racing game wasd control work,positive
bros not tell like game good play graphic story well people take storage developer solve problem delete old quest helpful low end device,positive
want world popular game add player vs player function want kill beastmonster bcz boring fight againt monster game animation fighting system u add player vs player function boom game week want fair fight s possible fight againt real player add function meed change enable pvp game player fight,positive
good graphic experience task interesting excellent not know phone problem game problem new phone large storage space week open game not open show game bug check thing awesome,positive
fun game take way storage nice skip dialogue not problem mean nice primogem easy s,negative
new reward story quest long dialouge option character story quest not character main random npc waste hour quest not feature banner unit basic npc reward give exploration story quest drivel aside archon quest way alt tab random option dialouge force input infuriating,negative
honestly hate game cringe player stuff bad actualy quest stuff keep motivated play literaly get rank n day discoverd like part map,positive
genshin impact completely redefine expect openworld rpg stunning visual pair expansive world life moment game feel like work art character design gorgeous feel unique personality combat style offer endless possibility team composition,positive
nice game buy welkin week hu tao fund see game think graphic fake game truly amaze music character scenery thank wonderful game mihoyo hoyoverse truly life well happy natlan update not believe ve play game year genshin truly life well,positive
m wait forever start long update omg long conversation sooo stupid enemy impossible defeat screen unstable specially compat bcz camera ancle unstable difficult compat game soooo fke stressfull waste time,positive
star canjust bug accure world quest pop bring near impossible puzzle solve right start want clear quest list like organized person like thing chapter v natlan archon quest chapter l liyue reach chapter iv fontaine dock occupy quest natlan goodbye fontaine enter,positive
ve play genshin year laptop ve problem recently get new phone hv alt acc europe server tend switch account switch europe server need download extra resource not download europe server automatically download asia server main acc download s new quest wait download,positive
like game graphic laggy chance get star charcater low begginer pkayer spend primogem end wasteand suggest increase character drop release star characterthat,negative
omgnice gamegreat animationsamaze charactersleisurely nature soundlike omg saurrrrr gooood suddenly today th october genshin impact stop say genshin impact close app bug try update app developer provide fix error s fixdo asap nahidas bday quest complete quest pleaseeee fix asap great game tbh m give star error,positive
right date gameplay voice character dialog lazy add company make billion not deliver voice linesi recommend game beautiful ton content definitely like care little game,positive
love game character design beautiful story amazing world stunning issue not run mobile take space amazing game,positive
ve play game year experience player go gameplay good easy understand elemental reaction easy remember accommodate storyline plot good character pretty write love detail people know experience glitch fix time overall highly recommend game fun great time pass bore,positive
anime inspire game ve play fine not care individual wish free play open chest quest end basically character design nice not diversity especially skin tone well pay expensive not afford itthen feel sad get character like,positive
problem message come insufficient storage enter load datum message keep pop say storage try leave relogging work,negative
not understand character late archon quest birthday celebration anecdote voiceless awkward embarrassing paimon have voice time hope hoyoverse change future normalize issue m sure player not amuse,positive
use fix artifact system rng overall game solid character story fantastic music lifechange combat varied flexible exploration fun plus get ton qol improvement year great thing well,positive
game good m addicted explore play friend s lot go game wish add feature like edit traveler look think s game standup,positive
amazing absolutely adore genshin impact start play month ago completely obsess storyline game play graphic character reward etc fantastic fact m go create second account replay game beginning actually know wish game forever m look play game similar good genshin thank hoyoverse gem,positive
stay away game yrs come end worth find today grind character weapon artifact talent need money area room require resin level drop item guarantee defeat boss sad bcuz pride play game end worth game,negative
nice game buy welkin week hu tao fund think graphic fake truly amaze music character scenery thank wonderful mihoyo hoyoverse life happy natlan update believe ve play year genshin,positive
nice game play love quest interesting lot caracter issue firstly space secondly time loading recently dialogue mute exept paimon solve reward like honkai star rail recomend start ll quit,positive
game character play genshin impact visually satisfy beautiful control simple crossplatform experience seamless console home laptop travel pick leave phone spend dime want story immersive evolve new adventure constantly add impressed aspect recommend,positive
game play want add controller separate company apple product provide android player calculate ratio download platform hardly difficult ps compatibility launch,negative
game quest story new player wise good boring old abyss easy end mode ok complete daily routine open commission use resin close uninstall soon,negative
game graphic character like story aspect abyss complete daily resin great terrible term imagine breath wild lore storyline arguably world design remotely challenge spiral rinse repeat day grind event feel mini barely utilize,positive
game character lot ll spend want difficult open resin term world barely massive variety elemental power multiple weapon include mage long downside insanely artifact equip stat look plus single run farm different type instead hard energy exactly build developer improve,positive
game interesting beautiful player good easy downside hard pretty big load fp currency deep plot wish little overall,positive
game issue run ping bad ms edit maybe connection lag crash cutscene musicdialogue choppy point wher decide turn volume completely contact month ago surprisingly fix thou network provdr smoothly stll smtime,positive
game update play developer fix bug cause work delete app datum cache pop try happen friend normally,negative
game graphic character update love quest like new player easy great storyline world feel look different amazing stunning explore region enter forward especially suggestion translator chat box communicate country coop challenge team,positive
game life play year genshin impact pick player boring use developer month team obsess repetitive gameplay care feedback choose incorporate quality change speak implement qol request shame dev need,positive
game ve leave try amazing kick jade chamber grab paper snow checkpoint unlock save,positive
game graphic character play year phone story recommend lag crash happen amazing unreasonable hate people highly bulky low setting worth,positive
game graphic genshin start impact experience story open world design feel different explore incredible grip breathtake topnotch animation huge location beautifully area exciting place special wellcrafte combination worldbuilde visual pull blend art exploration perfectly fantastic finish,positive
game play quest like story good end open world try explore low art device install ram harmful style collect charecter way fun,positive
game music character play year experience constantly good weapon bad fix qol animation exploration excellent audio enjoy properly camerasomethe veiw combat reason seizure eye problem touchscreen lack customizable key layout joke,negative
game week character update play time like controller end use grind long wish overall point friend save fun oct google pc purchase battle passover banner limit expensive limitation gatcha probably period original needy support droid user,negative
game think play lot like add good look wish edit friend explore addict feature traveler standup,positive
game update play love time loading like beautiful phone new old end little crash app try change low device tho yrs budget kinda fast suddenly reinstall result focus opt render distance smth,positive
graphic character update ve recently like new open include crash ram eversince frequent samsung gb sudden movement fight enemy thing freeze frame random second menu low experiment suitable,negative
game play year lot dialogue spend story good long type pretty need fun enjoy thing half assure minute hour notice figure bit google plentiful guide advice mood appreciate skip button,positive
game music character update love quest star beautiful story new good world long instead month ago amazing art finish style thing initially review anymore faith main patch drop quickly stagnet ask hsr personally annoying,positive
game truly character scenery play quest like story bore event wish overall amazing exploration way combat traveler thing notice line bore archon voice possible actually,positive
game year controller company android good use artifact improve feedback qol people lack support feature actually fall deaf ear severe consider age proper endgame content loadout custom domain creator perfect alas temporary usual tonedeaf money billion dollar,negative
game home open connection decide turn datum happen gameplay place pull problem suddenly possible randomly sure explain playtime datum claim service screen signal live strong wifi fine,negative
game graphic character update play love like start story adventure good design feel gameplay visual main action aver smartphone heart touch bestthe journey development awesome future,positive
game truly thank play beautiful experience impressed recommend good open great world look hard work try device finally gamer fond rpg mobile damn job definitely mean miss create masterpiece,positive
game character thank play year lot like experience open great lore world design feel developer work exciting art battle explain journey future azame ost theme unique playstyle word real hat present effort,positive
game ve play love lot travel want great design feel long energy bad choose need people art thing random strong ad freedom lose learn remind minecraft soo read fight busy,positive
game character quest story good world plot stunning especially huge visual archon remind overhate ton goate fontain building sao apart fan weird,positive
nice game update ve play time like story long improve coop hate people visual exploration main patch understand suppose follow sheep chance listen fandom cook novel,positive
character ve play genshin love quest lot mute like star impact storyline design feel different amazing style voice rate unfortunately silence loud right eng actor,positive
game character ve genshin love quest lot like story good bore great world app explore art device way tho gb mobile damn storage dedicate hell sorry ridiculous let gacha,positive
think genshin issue like star soon contact fix try request need support possible miss rate login account later hope badly,positive
game graphic natlan update play issue time new android load edit lag crash cutscene turn completely low set audio minute review severe strong mobile fps overlap hear aggravating deal unplayable walk inch entirely,negative
game hu tao graphic character play genshin love quest new recommend pretty amazing highly favorite outfit skin,positive
character thank interesting paimon like want story easy great world event amazing explore save fun right hey guy benevolent summon adorable,positive
game character scenery life ve play love quest issue star story recommend good lag people fun user thing mobile real understand small understandable deserve rating help,positive
game character year lot time pick story long people fun enjoy problem content ton favorite clear bore rerun available kill enjoyment able,positive
game update play genshin like impact phone new download good old worth problem gb hour annoying actually finally wait instal sleep shade wake laggy stop come get waste,negative
game character genshin love quest dialogue like experience complete lore feel amazing archon voice weird fact kinich ruin gaming alot begin,positive
