cleaned_snippet,rating_label
ve review decide edit response current opinion game great graphic stunning story nice long excessive make feel like chore end game get reward struggle farming upgrade character hassle resin energy cap upgrade cost energy lower game good time consume,positive
fun wish fighting quest bunch talk run come quest want leave game bring potential awesome battle turn dialogue not skip lot potential leave ability skip dialogue,positive
fun game enjoy story ton ton content clear bore pick problem long time character rerun year character available kill enjoyment lot people not able favorite,positive
game phenomenal art style scenery stunning yes game long s fun take journey give memory worth remember combat fun devs work storage control have issue game size ignore hatefulspam review bot people try ruin joy,positive
love game incredibly laggy point unplayable graphic low setting include fps manage crash not storage lot point genshin barely make dent not wifi run smoothly app fix optimize well mobile player,negative
obsess game not play month boring repetitive gameplay get developer not care player feedback pick choose feedback use incorporate quality life change speak take year implement qol change request year shame genshin impact dev team need well,positive
highly recommend play game year impressed mechanic captivate storyline constant update game interesting ensure player stay engage lore impressive graphic great gameplay absolutely awesome cutscene especially update impressed reccomende friend enjoy play game till day,positive
hello absolutely love game incredible graphic ton fun play lately try open say game bug kick loading screen say developer need fix issue game open fix issue love game look forward play end day thank,positive
ve play game january th real complaint style nice fan service character interesting way s soooooo s go to add game make boring old phone samsung galaxy se run smoothly ll glitch bad pc pc run bit life explode play game,positive
unintereste character unintereste dialog story potential not tell year game story not complete relese moreit get boring quickly usually open world adventure game find explore gorgeous open world hour engross story enjoy write character game deliver thing,negative
amazing game beautiful character design amazing s say recent issue game crash m d think crash crashed m wander middle dialog right complete domain force redo compatibility mode run smooth not help crash,positive
love game couple issue take sooooo space phone hard character storyline one amazing game definitely recommend edit ok m ve get new character friend teach use wish system hehe ve get geo archon quest fontaine beautiful city not wait new update thing mobile glitchy understand,positive
initially star review long review anymore good faith love art style game music amazing world beautiful month ago finish main story new patch update drop main story finish quickly character story quest game get stagnet thing ask hsr instead personally annoying love,positive
mobile phone game play start play honestly fun ve game long time m glad get support external storage device allow external memory stick insert thr game optimize feature graphic section game option menu ll analyze device automatically adjust game run smoothly possible say device nice,positive
play sep game beautiful love different nation character design undtrack topti enjoy world exploration puzzle battle difficult leave review current state game leave pretty disappointed frustrated lategame content dull monotonous tedious socalled reward insult measly plain stingy gatcha game well,positive
awesome game main story quest extremely wellwritten immersive country design enjoyable puzzle unlock reward elemental fighting system unique fun exception character beautifully design fairly easy resource obtain highly recommend,positive
game long certain quest like rollercoaster high lot quest low hard get high level definitely cost money want wish character special weapon purchase special item use lot memory get sluggish not memory later not build character correctly difficult time repetitive farming battle,positive
ve play game year little release pretty fun like aspect game like lore gameplay character overtime feel like event story get boring repetitive especially recently ve get disappoint new character design like emilie natlan character sethos not feel special old one end game experience not great,positive
feel like game lot fun not use eat battery storage wifi not load lot time understand big game need lot resource function crash single time ridiculous time actually able play amazing m seriously think give genshin,positive
lot massive open world variety character elemental power multiple weapon include mage long term game downside insanely difficult artifact equip character stat look plus single run farm different type artifact instead make hard ll spend lot resin energy barely exactly want build single character developer improve,positive
like game early game story fun like old character ton issue player continue bring fall deaf ear late game play not scale exp random bad guy run map world level increase difficult level character later gameplay random bug thing refuse fix needle will not redownloade,negative
star dock personal opinion people review address poor recent character design slow story wish option let pick commission want reach max reputation nation annoying try certain one unlock sort storyline achievement cool interact commission board pick,positive
pretty good game good graphic cool design character nice storyline voice act freely explore game high ar get boringi try like permanent mini game great game,positive
great game enjoy lot try come love explore accomplish quest come exploring thing notice recently completely change thought game experience try sign tend laggy crash time thing want point fact not fun update attention game,positive
genshin impact visually satisfying beautiful game control simple crossplatform experience seamless play console home laptop travel pick leave phone m spend dime not want story immersive evolve new character adventure constantly add m impressed aspect genshin impact not recommend,positive
love genshin character story exploration fun resin cap annoying ftp make build character time long hard sice genshin big make hard storage issue get bad delete past datum genshin beautiful game fix lot issue yay hate storge,positive
strong mobile android fps lag overlaps move hear audio get severe aggravating deal play time turn completely unplayable edit review new update natlan game take minute load cutscene walk inch crash game entirely low graphic setting not issue update,negative
ve see add youtuber sponsor yard tell day play game actually pretty good definitely fill need upgrade slowly strong equipment character not mistake have high level enemy not possibly fight near beginning common mistake game ease slowly introduce game mechanic hook,positive
gameplay play great character neat open world exploration fun force sit second dialogue frustrating interesting d like able skip dialogue have sit lastly make easy level exist character constellation wish great new character will not use hard level exist character,negative
great game aspect terrible term imagine breath wild well graphic well lore storyline arguably well character world design character remotely challenge game spiral abyss complete story game rinse repeat daily day resin grind event terrible feel like mini game game barely utilize character,positive
great character storyline task honestly game need permanent feature like windteace offer fun ve actually game daily grind stuff farming questing boring progress character game hoyo permanent friendly competition game waiting game event come,positive
play half year assure good pretty fun game type game play minute go to spend hour notice long figure thing need bit googling s plentiful guide advice s lot story dialogue mood appreciate skip button enjoy,positive
start couple year ago feel like breath wild clone huge world climbing glide good fast reactive control fun combat impress free keep increase size world enhance ui add story add cool character new ability reason explore story voice act actually good start damn good get well free amazing,positive
absolutely love game graphic story exploration character fun good variety mechanic use find fun building character problem nice reroll option artifact substat artifact farming well primogem reward s currency weapon character wish event chest bit reward,positive
love play genshin phone currently not open game play shut not loading screen show hoyoverse screen immediately shut phone say s bug will not let open game developer fix bug samsung galaxy gb m pretty sure not wrong phone ve try delete redownloade not work,positive
story line combat quest scenery exploration truly amazing way get bored play thing game notice archon quest character voice line make story boring wish possible way actually play traveler like event overall amazing game,positive
wonderful experience virtual reality real life love game awesome gameplay storyline character lot good play friend new friend event wild like dendro archon event wish event like bad quest hard new player like unable coop month,positive
beginner genshin impact rlly rlly fascinating breathtake adventure graphic rlly smooth apart advantage game take lot space gb lot theory item need understand properly difficult play game rule knowledge power make sense overall star error problem bonus character design humor story strike,positive
love game quest interesting lot interesting caracter issue firstly take lot space secondly take lot time loading recently dialogue caracter mute exept paimon solve issue nice reward like honkai star rail recomend game start play game ll go quit,positive
game beautiful devs lower draw distance explore low resolution polygon place holder right object building look like toy block mountain look like belong ps game grass tree rock pop map disappointing compare play version galaxy s ultra ps,positive
love game especially experience explore new territory meet expectation player climbing expectation treasure chest teleportation feel satisfying beautiful scenery designbgm pattern game feel consistent downside quest bug action button character disappear,positive
like genshin impact storyline amazing love character design different play style ve rate star unfortunately lot character mute silence feel loud quest voice character not feel right eng voice actor,positive
game randomly decide turn datum gameplay sure explain playtime data connection suddenly claim service pull game home screen signal happen open game live place datum signal strong not possible wifi fine datum problem,negative
game big flaw long take character pr weapon rerun resin respawn rate have character aside game amazing storyline enjoyable character different story quest event incredible music super fun gameplay mechanic world building astonishing scenery overall tell effort love passion experience real journey enjoy,positive
game great story lot quest end game content hard play phone not know character icon r small make hard press hit enemy joystick reset thumb tell thumb play year prosgreat story quest consend game hard play icon r small joystick not thumb,positive
overall fun game good story arc good character world design interesting combat system elemental reaction easy spend month theory craft team composition skill battle system rate higher not provide game feature android certain option like controller support available io android,positive
game amazing fact character voice like kinich ruin gaming experience feel like m complete archon quest alot dialogue begin weird ruin game like lore love genshin,positive
game overall fine suck not skip dialogue sit storage take ridiculous kind understandable wait version come usually fun recent banner end hour new banner come limit suck not sense go different ascension material come different day well reward,positive
someone gacha game not bad play year phone pc glaring issue take space pc phone early game content pretty good fall drastically month get repetitive quickly lot fetch quest game treat like story constantly repeat dialogue not paimon get lot bad time let think,negative
graphic great gameplay fun scenery breathtake beautifulbut not star major problemthis game story waaaayyyyyyyyyyy talkingyap yap yap yap yapand not skip conversationit take minute minute yap non stop annoying voice paimonif not skip well watch anime movie click need skip button,positive
new player incredible frustrating experience exploration character lore craft stand similar game archon quest memorable exciting flaw writing downside experience banner system change age ago main problem increase number character game make impossible accommodate rerun effectively,positive
ve play long ad freedom play lost energy play choose love not need play people strong feel need not want bad m learn game remind minecraft soo well art design detail lot read travel great random fighting random thing busy,positive
game pretty good gameplay smooth story amazing good s bug enter game second game crash kick try fix problem long time luck,positive
game amazingbut todays morning ve problem game work launch normally logo appear kick application time get notification game bug devs need fix friend not problem not play game fix problem uninstalle reinstall reset device check storage connection work,negative
love game problem voice act recent event nahida not voice hate love everyone voice hope hoyoverse fix problem studio vas try use ai hate not let studio use bad ai voice make mad fix en vas,positive
game good yes reason lacking lot vital feature domain pain good artifictsit significantly impact gameplay make game play feel like chore fun like start feature skip domain gameplay ve play time like cooking mechanic standard banner need update rework,negative
amazing game love character storyline graphic stunning explore new region feel like enter different world look forward update especially new character quest suggestion great translator chat box communicating player country coop challenging translator team easy,positive
genshin deserve star review great game nice quality character design story quest wonderful main story quest world quest annoying sit uninteresting dialogue end day perfectly fine need bit patience fit lot play style find like game m mark short game,positive
bad game hard play mobile m android game not provide controller support game thing ios platform release wild absurd use controller game literally platform android rd party interference,negative
fine like story character easy burn game bp welkin little difference resource scarcity make grind way make easy domain horrible roll good artefact rate bad d star character not want end spend upwards character want not dumb like spend money game,positive
honestlyi download yesterday love like like watch anime play time usually game story line make read lot wanna read read fav webton instead skip lot audio love thing not like far character bit slow make run drain stamina quickly oh take lot space like gb lot,positive
game story graphic good control sucks dpad movable button adjust atleast place screen m unintentionally action especially dpad low screen touch character automatically move forward fix control button dpad adjustable,negative
great game grind character leveling repetitive weekly domain difficult improve character premium currency primogem difficult come past qol issue beautiful rpg fun gameplay excellent storyline notch not wait new area patch,positive
great game good quality world building world exploration vast find hard obtain reward extensive grind primogem s skip button annoying honestly,positive
year play daily good live service game nowadays up down genshin amazing piece art especially music game novel adventure lot exploration puzzle constant event different minigame love,positive
want play game long time finally find compatible device play amazing think maybe suggestion ticket system wish new banner player constellation certain character character appear character turn ticket corresponding star star collect ticket exchange character old banner hope ll help,positive
good game play mobile pc game good ost music scenery landscape storyline character design thing truly masterpiece issue devs provide primogemsin game currency pull upcomme banner free pulla worth major update nice major issue bit problematic love game,positive
pointless playing play game coupon go uninstall play pc exclusively game not worth keep phone real space ll countless line event exclusive nonrepeatable dialogue reach endgame story meander filler character introduce bc gacha system limit story potential fan,negative
take huge twoish year gap fontaine get release lot enjoyable play reason like character power design etc area farm artifact system suck reason like ugh natlan character release include emily pretty eh new main story style save people hate lot maybe natlan ugly,positive
game fun run phone story great complain star control onscreen control absolutely terrible ios controller support android not mention number time accidentally click character ultimate try jump change camera angle close add controller support android year game launch ff,negative
improve experience little game setting take break fight game aesthetic worth time ve spend game story devs put guess rush head game loose perspective escape need game thank game hoyoverse,positive
great game play year get tired major improvement term qol entire game generally artifact system change story dialogue take time voice go gacha not improve limit weapon banner get original form bad play game excited lot restriction deceive audience,negative
gi fun adventure game play year easy ascent character need work hard get lucky strong characterweapon artifek player spend lot primogen intertwine fate not strong gold character weapon overall game fun developer add mark sign lose forget farming,positive
good action adventure game aver play smartphone update good graphic heart touch character design bestthe game start journey journey feel like main character game story development character development visual gameplay game awesome love play game future,positive
game fun get boring progress reward suck game want pull new character reward good take hour pull love character design like say impossible pull character spend money,positive
fix dumb bug not primogem old achievement old commissionqu like tale winter achieve tell geo travel diary geo archon anecdotes liyue not finish dumb achievement unknown reason time,negative
scamtifye elixir twin mc kid prefer grow version npc copy paste look slight difference lack detail design look bore game good job detail combat experience good game rely elemental reaction dodge mechanic boring sprint well slow real dodge animation,positive
game actually good problem phone wait like hour instal update etc sleep instal shade wake instal finally good laggy phone new old stop play genshin impact come download update shade getting annoying worth wait waste gb game,negative
hard good rating thing worth play genshin impact story story like inazuma bad music rest experience gameplay level character talent artifact exploration quality life fix worth watch youtube story listen spotify music,negative
ve play game year damage text bug grass not ice dvalin signora boss fix m sure phone problem hoyo update tell situation abt bug state cos denial woukd great length able damage mobile screen,positive
good game play year actually unbelievable lil addicting quest r boring new update genshin definitely get well love new character star def storage lil player maybe fix issue wifi rlly bad game require good wifi s issue face great game love m hook,positive
game fine honestly standard banner stuff player pull banner actually want standard character random useless character understand luck bad lose high pity like hopefully change system like go to player lose,positive
game interesting storyline boring make frustrating play hard farm fp take time not start char build thing like game character graphic literally play character not time build,positive
m happy game rewardsand thing end game challenging fun right build teapotbut want like lake lake glitch st kinda annoying hope hoyoverse option create lake water foundation helpful thank,positive
beautiful game m glad instal galaxy run beautifully grow playing game like legend zelda love art style enormous open world explore music voice act perfect story complex interesting fan hoyoverse hope m finally able enjoy timeless work art favorite dev team,positive
thank genshin give unforgettable gaming experience love graphic character design story theme music ethereal scenery late story escape night kingdom experience horrible lag plus time limit reach wind current m aware poor device likely problem grateful expand time limit m stick forever,positive
true perfection storyline gameplay gatcha perfect start play not know addict favorite game thing place love collect character get love storyline stimulation game get fighting yep not wait play,positive
play long time like change device oppo ae ve have problem run month d crash lag d restart game month black mid cutscene kick game game ill start cutscene kick,positive
amazing lore nice gameplay unique character cool design beautiful fantasy world inspire real life region noticable not accurately represent culture limitation skintone thing d like mention genshin fail story tell tell deviate main plotline traveller search twin aspect overall great game,positive
star play android start play covid great time feel pressured purchase explore fun puzzle not challenging bore people play meta grind lot not lot fun story interesting boring skip dialogue thing stop star game lack racial diversity lack reward quest irl event,positive
game force sit extremely long boring slow loading dialogue hour option skip despite people ask option year issue limit world quest go event matter ask listen user update increase rating star cause ve make positive change add reward hope improve,negative
soundtrack graphic scenery wonderfull like main story lot character design cool wish diversity definelly good thing region character mission characteristic sorry english mistake simulanka permanent event,positive
tw hk mo server despite have good connection experience minor laggy garble storyline introduction play like not fix get point intro choose character lag disappear oh upgrade new phone not solve issue believe issue game network provider indosat game capable provide hour fun vibrant bright world character collection cool,positive
genshin impact incredible game grip story breathtake graphic topnotch animation open world huge location beautifully design explore different area exciting place feel special wellcrafte combination worldbuilde visual pull game blend art story exploration perfectly make fantastic experience start finish,positive
amazing character design game play idea event frustrating quest description not help especially pause quest clue maybe quest description bit helpful great game not wait future update,positive
exploration good character weapon excellent animation excellent audio music excellent not enjoy properly camerasomething not fix year constantly fix veiw combat exploration reason seizure eye problem play game touchscreen bad experience lack customizable key layout qol joke,negative
game good story line great graphic pleasing play week game state lag badly ui unresponsive fps drop zero game graphic intensive game work fine medium high graphic setting oneplus t uninstallate,positive
hey guy great benevolent summon system character amazing world fun explore right character story interesting easy save character want thank event like paimon s adorable guy,positive
game good update good problem character not rerun year play tartaglia like play style fact join update not well not get rerun actually feel bad play m play year not think m go to quit atp m tired redownloade game,negative
good graphic mobile game par pc version interesting lorestory main reason play game yeah mid quest overall greatfor character need save primogem able character want s pity system okay artifact system rng kinda bad require lot grind guarantee good,positive
sit hour dialogue care listen ve replay game dozen time annoying wish feature skip story cutscene play game good game slowly end get hard hard find resourse lot game literally grind hour,negative
game great graphic issue frustrating skip button cutscene not skip long dull wasting time wait tap mission mission hard progress main story mission list cluttered mission unskippable cutscene add frustration hope developer address issue repetitive annoying,negative
game usually great recent update enjoyable lack english language voiceover especially annoying character speak make experience disjointed make want play issue resolve,negative
start release love graphic character design current update weapon banner well low cost music region different good music story build skip story value story kinda disappointing community value story low btw add skip button like people say people different taste pls commission pg,positive
overhated game huge world ton quest stunning visual goate plot especially fontain archon quest story good character building good game remind sao game good apart fan weird,positive
start go relatively ping horrible asias server change hks server recently s release ping get point not participate coop event have ms getting kick say asia hk server ve try test online game medium check s problem router ill grateful get resolve,positive
game animation fight scene detail nation amazing ton character play team play friend story interesting twist turn emotional roll coaster nation play game day love game,positive
