rating,likes,rating_label,cleaned_snippet
3.0,88.0,positive,while ive reviewed this before i decided to edit my response to my current opinion the game is great the graphics are stunning and the stories are nice however its very long and excessive it makes it feel more like a chore as you get more into the end game getting rewards is a struggle and farming and upgrading characters is more of a hassle than it should be the resin energy cap should be upgraded or costs of energy should be lowered this game is very good just time consuming
3.0,35.0,positive,very fun but i wish there was more fighting in the quests its just a bunch of talking and running around when it comes to the quests that just make me want to leave the game it brings me in with the potential for awesome battles but then turns me off with all the dialogue that you cant skip has a lot of potential at leave give us the ability to skip the dialogue
3.0,11.0,positive,fun game i enjoy the story there is tons to do and tons of content to clear so if youre bored pick it up the problem with it however is the long time between character reruns it has been over a year since some characters are available and it is really killing enjoyment for a lot of people when they arent able to get their favorites
5.0,77.0,positive,this game is phenomenal the art style and scenery are stunning yes the game is long but thats why its fun it takes you on several journeys and gives you memories worth remembering the combat is fun as well and the devs are working on storage control for those having issues with game size i would ignore all those hatefulspam reviews as its mostly just bots or people trying to ruin the joy for others
2.0,14.0,negative,i love this game however it is incredibly laggy to the point where its unplayable i have all the graphics on the lowest setting including the fps and yet it still somehow manages to crash it isnt my storage because i have lots of it to the point where genshin barely makes a dent in it and it isnt my wifi because it runs smoothly for all the other apps please fix this and optimize it better for mobile players
3.0,99.0,positive,i used to be obsessed with this game but i havent played it in months because of how boring and repetitive the gameplay has gotten the developers also dont care very much about player feedback and seem to pick and choose what feedback they use to incorporate into quality of life changes speaking of which it took them years to implement some qol changes that have been requested for years a shame but genshin impacts dev team needs to do better
5.0,65.0,positive,highly recommend i have been playing the game since last year and have been very impressed with the mechanics and captivated by the storyline constant updates keep the game interesting and ensure that the player stays engaged lore is impressive graphics are great during gameplay and absolutely awesome during cutscenes especially since update very very impressed have reccomended to many of my friends and all have enjoyed and are still playing the game till this day
4.0,29.0,positive,hello i absolutely love this game it has incredible graphics and is a ton of fun to play but lately whenever i try to open it it says that the game has a bug and kicks me out before i even get to the loading screen it says the developer needs to fix the issue before the game can be opened please fix this issue i love you game i always look forward to playing at the end of my day thank you
4.0,64.0,positive,ive been playing this game since january th i have no real complaints the style is nice not too much fan service the characters are all interesting in their own ways and theres soooooo much more thats gonna be added to the game not making it boring i have an old phone samsung galaxy se and it still runs smoothly sometimes itll glitch but not as bad as my pc since my pc was running on its last bits of life it exploded while i was playing this game
1.0,14.0,negative,uninteresting characters uninteresting dialog a story with potential that isnt told very well it has been years and the games story isnt complete i would have rather they not relesed it until there was moreit gets boring very quickly usually in other open world adventures games i find myself exploring the gorgeous open world for hours engrossed in the story and enjoying well written characters yet this game can deliver in none of those things
4.0,110.0,positive,amazing game its beautiful the character design is amazing and theres so much to do that being said i have had some recent issues with the game crashing often when im not doing anything id think would make it crash its crashed when im just wandering around in the middle of dialog and once right after i had completed a domain forcing me to redo it i used the compatibility mode so it would run smoother but that didnt help with it crashing
5.0,644.0,positive,love the game but a couple issues one it takes up sooooo much space on my phone two it is so hard to get any other characters than the storyline ones it is an amazing game and i would definitely recommend edit ok im back ive gotten so many new characters my friend taught me how to use the wish system hehe also ive only gotten to the geo archon quest but fontaine is a beautiful city i cant wait for the new update one thing mobile is glitchy i understand why though
5.0,665.0,positive,initially i had a star review i can no longer keep that review anymore in good faith i love the art style of the game the music is amazing and the world itself is very beautiful a few months ago i finished the main story when this new patch update dropped the main story was finished really quickly same with the character story quest this game just seems to have gotten stagnet things we have been asking for have been put into hsr instead personally its annoying show us some love
5.0,432.0,positive,its one of the few mobile phone games i play i just started playing and honestly its the most fun ive had in a game for a long time im glad i got it it also supports external storage on devices that allow for external memory sticks to be inserted into them thr game has an optimized feature in the graphics section of the games options menu itll analyze your device and automatically adjust the game to run as smoothly as possible for said device its very nice
3.0,212.0,positive,been playing since sep the game is beautiful i love the different nations character designs the undtrack is toptier and i really enjoy the world exploration puzzles and battle it was difficult for me to leave such review but the current state of the game has left me pretty much disappointed and frustrated lategame content is dull monotonous and tedious and the socalled rewards are insulting measly and just plain stingy even for a gatcha game please do better
5.0,412.0,positive,this is an awesome game the main story and side quests are extremely wellwritten and immersive all the countries are well designed and have many enjoyable puzzles to unlock various rewards and the elemental fighting system is really unique and fun with a few exceptions all the characters are beautifully designed and its fairly easy to get enough resources to obtain them i highly recommend this
5.0,337.0,positive,there is so much to do in this game as long as you do certain quest its like a rollercoaster with high lots of quest to lows the harder it gets the higher level you get definitely can cost money if you want to wish for more characters or special weapons or purchase special items however it uses a lot of memory if it gets sluggish then you dont have enough memory also later on if you dont build your characters correctly you will have a difficult time repetitive farming battles
5.0,1301.0,positive,ive played this game for about or years only a little after its release and its been pretty fun i like some aspects of the game like the lore gameplay characters but overtime i feel like the events and story have been getting boring or repetitive especially recently ive also been getting disappointed with new character designs like emilie the natlan characters sethos they just dont feel as special to me as the older ones do then again end game experience isnt that great
3.0,11.0,positive,i feel like this game would be a lot more fun if it didnt use as much as it did it eats up my battery my storage my wifi and so much more when it doesnt even load a lot of the time i understand its a big game and that it needs a lot of resources to function but doing all of that and still crashing every single time is ridiculous any time i actually am able to play it its amazing but im seriously thinking about giving up on genshin
4.0,434.0,positive,a lot to do in a massive open world variety of characters and elemental powers with multiple weapons including mages its a long term game downside its insanely difficult to get artifacts to equip characters with the stats you are looking for plus in a single run to farm them it has two different types of artifacts instead of one which makes it even harder youll spend lot of resin energy to get barely or exactly what you want just to build a single character developers should improve this
1.0,1282.0,negative,i really liked this game the early game story was fun and i liked the older characters but there are a ton of issues that the players continue to bring up that fall on deaf ears the later game play doesnt even scale up the exp of the random bad guys you run into on the map as your world level increases so its much more difficult to level up your characters in later gameplay along with random bugs and things they just refuse to fix needles to say i wont be redownloading this one
3.0,14.0,positive,two stars docked because of personal opinions that most people in the reviews have already addressed poor recent character designs slow story i just wish there was an option that let us pick which commissions we want after we reach the max reputation in a nation at least its so annoying trying to get certain ones that unlock some sort of storyline for an achievement it would be cool if we could just interact with the commission board ourselves and pick it out
4.0,0.0,positive,its a pretty good game good graphics cool designs for characters nice storyline and voice acting you can freely explore the game but once you get to a high ar it gets quite boringi would try and make it where you give like a permanent mini game otherwise its a great game
3.0,256.0,positive,this is a really great game and i do enjoy it a lot whenever i try to come in i love to explore and accomplish the quests that come with the exploring however there are a few things that i noticed recently that has completely changed me thoughts during the in game experience whenever i try to sign in it tends to be very laggy and it crashed several times another thing i do want to point out is the fact that there isnt much fun updates or attention that is put to this game as the others
5.0,170.0,positive,genshin impact is a visually satisfying beautiful game controls are simple and the crossplatform experience is seamless i can play on my console at home my laptop when traveling and pick up where i left off on my phone when im on the go and all without spending a dime if i dont want to this story is immersive and always evolving with new characters and adventures constantly being added im just really impressed with every aspect of genshin impact and cant recommend it enough
4.0,115.0,positive,i love genshin and there characters and story also exploration is fun but the resin cap is very annoying as a ftp it makes building a character ten times longer and harder and sice genshin is so big now it makes it even harder to keep up also the storage issues are getting really bad even if i delete past data but besides that genshin is a beautiful game they fixed a lot of issues yay still hate how much storge it is
2.0,41.0,negative,on a strong mobile android the fps and lag overlaps everything from even moving or hearing audio it gets so severe that its aggravating to deal with while playing every time it turns completely unplayable editing the review because since the newest update for natlan the game takes minutes to even load a cutscene or walk an inch to somewhere it even crashes the game entirely at the lowest graphic settings this wasnt an issue until this update
5.0,1280.0,positive,youve seen the adds youtubers sponsoring this the whole yards i am here to tell you after a few days of playing that the game is actually pretty good it definitely fills that need to upgrade and slowly become stronger with equipment and characters it also doesnt make the mistake of having high level enemies you cant possibly fight near the beginning a common mistake many games make it eases you in and slowly introduces more and more game mechanics as it should for now i am hooked
1.0,1348.0,negative,the gameplay play is great characters are neat and the open world exploration is fun being forced to sit through more than seconds of dialogue is frustrating because its not interesting id like to be able to skip all dialogue without having to sit through it lastly making it easier to level up existing characters constellations without using wishes would be great i have new characters who i wont use because its too hard to level up my existing characters
3.0,75.0,positive,great game in many aspects terrible in terms of others so imagine breath of the wild but with better graphics better lore and storyline arguably better characters world is very well designed so are characters nothing remotely challenging in the game though other than spiral abyss after completing the story the game becomes a rinse and repeat of just doing dailies every day and resin grind events are terrible feel like mini games within a game and barely utilize any of the characters
3.0,27.0,positive,it does have great characters and storyline and what not but it is becoming more and more a task honestly this game needs more permanent features like what windteace even had to offer that was the most fun ive actually had on this game in a while the daily grind of stuff and farming and questing is boring but have to do it to progress the characters in game please hoyo give us more permanent friendly competition in game without it being a waiting game for an event to come around
5.0,94.0,positive,playing for about a half year i can assure you it is a good and pretty fun game it is not the type of game that you can play for a few minutes but one you gonna spend two hours on without noticing it was this long already figuring some things might need a bit of googling but theres plentiful guides and advice everywhere theres quite a lot of stories and dialogues which i sometimes not have mood for and would appreciate some skip button but some might enjoy that
5.0,82.0,positive,when it started a couple years ago it felt like a breath of the wild clone huge world climbing gliding good fast reactive controls fun combat i was impressed all that for free then they kept increasing the size of the world enhancing the ui adding more story adding more cool characters new abilities and reasons to explore and the story and voice acting is actually good it started damn good and has only gotten better really well done and free its amazing
5.0,167.0,positive,i absolutely love this game the graphics story exploration characters everything its so much fun and has a good variety of mechanics to use and find out its fun building characters too my only two problems are one it would be nice to have a reroll option on artifact substats this would make artifact farming much better for me two more primogem rewards thats the currency used to get weapons and characters and i really wish events and even chests had a bit more rewards for that
5.0,57.0,positive,loved playing genshin on my phone though as of currently i cant even open up the game to play without it shutting itself down it doesnt even get to the loading screen it just shows the hoyoverse screen and immediately shuts down my phone says theres a bug that wont let me open the game until the developer fixes the bug i have a samsung galaxy with gb im pretty sure there isnt anything wrong with my phone as well ive tried deleting it and redownloading it doesnt work
5.0,264.0,positive,from the story lines combats quests scenery and exploration are truly amazing in their own way i never gotten bored of playing since there are so many things to do in this game i noticed that the archon quest in some characters had no voice lines in which it makes the story quite boring and wishing there are possible ways to actually play with other traveler like events overall its an amazing game
5.0,49.0,positive,its a wonderful experience between virtual reality and real life i love this game because it has awesome gameplays storylines characters and lots more the best part is you can play it with your friends or make new friends it in the events are wild like the dendro archons event i wish to have more events like this too but the bad part is that some quests are hard for new players like me one of it made me unable to coop for months
5.0,11.0,positive,as a beginner genshin impact is rlly rlly fascinating it is breathtaking adventuring and its graphics are rlly smooth apart from those advantages the game takes up a lot of space its gb besides there are a lot of theories and items we need to understand properly which is difficult to play well the games rule is knowledge is power so makes sense overall out of star no errors nor problems yet bonus the characters designs humors and stories are also striking
5.0,115.0,positive,i love this game quests are very interesting and there are lot of interesting caracters but there are few issues firstly it takes a lot of space secondly it takes lot of time in loading also recently in the dialogues caracters are muted exept for paimon and please solve this issue it would be also nice to give us more rewards like in honkai star rail but i really recomend this game because once you start playing the game youll never going to quit it
3.0,5.0,positive,the game used to be beautiful now the devs have lowered the draw distance so that when ever you explore you just see low resolution polygons and place holders until youre right beside an object buildings look like toy blocks and mountains look like they belong in a ps game the grass trees and rocks pop in as you move around the map its just so disappointing compared to how it used to be playing since version on galaxy s ultra and ps
5.0,78.0,positive,i love this game especially for the experience when exploring new territories and it meets my expectations as a player such as when climbing and the expectation that there is always something above even though there are no treasure chests teleportation or anything else it still feels satisfying because of the beautiful scenery designbgm the patterns in this game feel consistent the downside is that there are some side quest bugs that make the action button on the character disappear
4.0,97.0,positive,i really like genshin impact and the storyline is amazing i love the character designs and the different play styles i wouldve rated it five stars but unfortunately lots of the characters are mute and the silence feels so loud the quests without the voices of the characters just dont feel right please get the eng voice actors back
1.0,13.0,negative,the game randomly decides to turn off my data during gameplay not sure how to explain it but during playtime my data connection suddenly claims no service pulling me out of the game after it did and i go to my home screen the signal is back this only happens whenever i open this game i live in a place where data signal is very strong so i dont how that was possible wifi is fine but the data one is the problem
5.0,83.0,positive,this game has big flaws such as how long it takes for characters pr weapons to rerun the resin respawn rate and having more characters than but aside from that this game has an amazing storyline enjoyable characters and so many different stories through the quests and events incredible music super fun gameplay mechanics world building and an astonishing scenery but overall you can tell how much effort love and passion they put into it its a experience and a real journey enjoy
4.0,19.0,positive,this game has great story and lots of quests to do how ever the end game content is hard to play on my phone i dont know if its just mine but the character icons r small so it makes it hard to press and if i get hit by an enemy it joystick reset so i had to move my thumb up and down it can tell my thumb is there after playing for years prosgreat story and quests consend game is hard to play when the icons r smalls and the joystick cant if my thumb on it
3.0,10.0,positive,overall fun game good story arcs good character and world design interesting combat system with elemental reactions you could easy spend months theory crafting team compositions with the skills and battle system i would rate it higher but they dont provide all game features to android certain options like controller support are available on ios but not on android
3.0,3.0,positive,this game is amazing but the fact that so many characters do not even have a voice like kinich just ruins the gaming experience it does not feel like im completing an archon quest and alot of the dialogues are beginning to seem weird please do not ruin the game like this the lore is something i love about genshin
4.0,89.0,positive,the game overall is fine it just sucks that we cant really skip any dialogues and we just have to sit through them the storage it takes is also ridiculous but kind of understandable however we have to just wait until version comes out usually this would be fun but the recent banner ends about hours before the new banner comes out the limit sucks and doesnt make sense the same goes for different ascension materials coming on different days also better rewards please
2.0,31.0,negative,for someones first gacha game it isnt bad but after playing it for over years on phone and pc there are very glaring issues it takes too much space both on the pc and phone the early game content is pretty good but it falls off drastically after a few months it gets repetitive quickly a lot of fetch quests the game treats you like you are during the story constantly repeating dialogue as if you werent there paimon gets a lot worse over time never lets us think
4.0,14.0,positive,the graphic was great gameplay was fun and the scenery breathtaking beautifulbut i cant give full star because major problemthis game the story waaaayyyyyyyyyyy to much talkingyap yap yap yap yapand we cant skip the conversationit takes around to minutes sometimes even more than minutes from yapping non stop the annoying voice of paimonif we cant skip it then we better watch anime or movie just by clicking we need skip button
4.0,22.0,positive,as a new players it is both an incredible and frustrating experience the exploration characters and lore are well crafted and stands out from other similar games each archon quest is memorable and exciting even with its flaws in the writing sometimes the downside in my experience is the banner system that has not change since ages ago the main problem is increasing number of characters in the game making it impossible to accommodate reruns effectively
5.0,31.0,positive,ive not been playing for long but no ad freedom play no lost of energy and play when you choose i love that i dont need to play with people but as i get stronger i really feel i need to but i dont want to that the bad side but im still learning about the game it reminds be of minecraft but soo much better at the art and design details i do have to say it a lot of reading the travelling around is really great and random fighting with random things to do it always keep you busy
4.0,0.0,positive,the game is pretty good gameplay is smooth and stories are amazing everything all good but theres one bug when entering the game after around seconds the game crashes and kicks me out been trying to fix that problem for long time but no luck
2.0,34.0,negative,this game is amazingbut since todays morning ive had a problem of the game not working it would launch normally but after the logo appears it would kick me out of the application after times i got a notification that the game is bugged and devs need to fix it my friends dont have that problem at all i cant play the game please fix this problem i uninstalled and reinstalled reset my device checked my storage connection and everything i could its still not working
4.0,4.0,positive,love the game and all but one problem with the voice acting in the recent event of nahida almost everyone doesnt get voiced i hate it so much because i love everyones voice so much i hope that you hoyoverse fix this problem of one of the studios for vas is trying to use ai which i hate please dont let that studio use bad ai voices it makes me mad fix it please also its the en vas
1.0,258.0,negative,the games good yes but for some reason its lacking a lot of vital features the domains are a pain to do over and over again for good artifictsit significantly impacts gameplay and makes the game play feel like a chore and not fun like it used to in the start there should be a feature to skip the domain gameplay after youve played it five or so times like the cooking mechanic and the standard banner needs a serious update and rework
