rating,snippet,likes,rating_label,cleaned_snippet,review
3.0,"OMG...nice game....great animations..amazing characters..leisurely nature sound...like omg it's saurrrrr gooood But suddenly today at 24th october genshin impact stopped saying that ""Genshin Impact closed because this app has a bug"" ""Try updating this app after its developer provides a fix for this error"" Please, if theres anything to fix..do it asap since it's nahida's bday and the quest i have to complete it and other quests pleaseeee fix it asap great game tbh i'm giving 3star for the error.",1.0,positive,omgnice gamegreat animationsamazing charactersleisurely nature soundlike omg its saurrrrr gooood but suddenly today at th october genshin impact stopped saying that genshin impact closed because this app has a bug try updating this app after its developer provides a fix for this error please if theres anything to fixdo it asap since its nahidas bday and the quest i have to complete it and other quests pleaseeee fix it asap great game tbh im giving star for the error,
3.0,Right now all of the most up to date gameplay has no voice characters dialog from being to lazy to add it. Even though this company makes billions off of us and they can't even deliver voice lines..I would still recommend the game it's beautiful and a ton of content to get through. But it definitely seems like they are caring a little less about the game,2.0,positive,right now all of the most up to date gameplay has no voice characters dialog from being to lazy to add it even though this company makes billions off of us and they cant even deliver voice linesi would still recommend the game its beautiful and a ton of content to get through but it definitely seems like they are caring a little less about the game,
5.0,"I love the game! The Character designs are BEAUTIFUL, the story is AMAZING, and the world is STUNNING! They only issues are it doesn't run well on mobile and takes to much space. Other that that amazing game!",3.0,positive,i love the game the character designs are beautiful the story is amazing and the world is stunning they only issues are it doesnt run well on mobile and takes to much space other that that amazing game,
5.0,"I've been playing this game for a year and my experiences as a player is going so well, the gameplay is good, easy to understand and the Elemental reactions are also easy to remember and accommodate. Storyline and plot is good and characters are very pretty and well written, I love that there are details that few people knows about. I experienced some glitches but it was fixed over time. Overall I highly recommend this game, it's really fun and great for time passing when you're bored.",360.0,positive,ive been playing this game for a year and my experiences as a player is going so well the gameplay is good easy to understand and the elemental reactions are also easy to remember and accommodate storyline and plot is good and characters are very pretty and well written i love that there are details that few people knows about i experienced some glitches but it was fixed over time overall i highly recommend this game its really fun and great for time passing when youre bored,
4.0,"It's the first ever Anime inspired game which I've played, and it's been fine. But they don't really care about you as an individual. You can get a few wishes if you're free to play, but unless you open every chest and do every quest you end up with, basically nothing. And while the character designs are nice, there isn't much diversity, especially in skin tones. You're better off paying, but that can be expensive, and I can't really afford it.Then I feel sad about not getting characters I like.",5.0,positive,its the first ever anime inspired game which ive played and its been fine but they dont really care about you as an individual you can get a few wishes if youre free to play but unless you open every chest and do every quest you end up with basically nothing and while the character designs are nice there isnt much diversity especially in skin tones youre better off paying but that can be expensive and i cant really afford itthen i feel sad about not getting characters i like,
2.0,"A problem with a message coming up as insufficient storage. When I entered after loading the data, a message keeps popping up saying that. I have the storage but I already tried leaving and relogging in. Did not work",1.0,negative,a problem with a message coming up as insufficient storage when i entered after loading the data a message keeps popping up saying that i have the storage but i already tried leaving and relogging in did not work,
3.0,"I still don't understand why characters, in the latest Archon Quest and Birthday Celebration Anecdotes, are voiceless. It's just awkward and embarrassing to see Paimon being the only one having a voice all the time. I hope hoyoverse changes this in the future and not normalize this issue, which I'm sure other players aren't amused about.",2.0,positive,i still dont understand why characters in the latest archon quest and birthday celebration anecdotes are voiceless its just awkward and embarrassing to see paimon being the only one having a voice all the time i hope hoyoverse changes this in the future and not normalize this issue which im sure other players arent amused about,
5.0,"Could use some fixes to the artifact system RNG but overall the game is solid. The characters and story are fantastic, the music is life-changing, combat is varied and flexible, and exploration is fun. Plus it's gotten a ton of QoL improvements over the years that have made a great thing even better.",0.0,positive,could use some fixes to the artifact system rng but overall the game is solid the characters and story are fantastic the music is lifechanging combat is varied and flexible and exploration is fun plus its gotten a ton of qol improvements over the years that have made a great thing even better,
5.0,"This game is so good that I'm addicted to it you can explore, play with friends. There's a lot going on this game but I wish they add more features like edit the traveler looks I think that's make the game stand-up more",0.0,positive,this game is so good that im addicted to it you can explore play with friends theres a lot going on this game but i wish they add more features like edit the traveler looks i think thats make the game standup more,
5.0,"Amazing!!! I absolutely adore Genshin Impact! I started playing about 3 months ago and have been completely obsessed with it. The storyline, game play, graphics, characters, rewards, etc, are fantastic! In fact, I'm going to create a second account and replay the game from the beginning now that I actually know what to do. I wish this game could go on forever. I'm looking into playing other games that are similar, but nothing seems as good at Genshin. Thank you Hoyoverse for this gem!",1.0,positive,amazing i absolutely adore genshin impact i started playing about months ago and have been completely obsessed with it the storyline game play graphics characters rewards etc are fantastic in fact im going to create a second account and replay the game from the beginning now that i actually know what to do i wish this game could go on forever im looking into playing other games that are similar but nothing seems as good at genshin thank you hoyoverse for this gem,
1.0,"stay away from this game. i did for 2+ yrs then came back to see if i make it to the end. it really not worth it. i found that out today after grinding again to get my characters, weapon, artifact and talents up!!!! almost everything needs money, area rooms that require resin, and leveling up drop items ( that are not guaranteed after defeating a boss). its sad bcuz i always pride myself in playing a game through to the end. it is not worth it for this game.",56.0,negative,stay away from this game i did for yrs then came back to see if i make it to the end it really not worth it i found that out today after grinding again to get my characters weapon artifact and talents up almost everything needs money area rooms that require resin and leveling up drop items that are not guaranteed after defeating a boss its sad bcuz i always pride myself in playing a game through to the end it is not worth it for this game,
,,,positive,,nice game bought welkin week hu tao funds saw thought graphics just fake truly amazed music characters scenery thank wonderful mihoyo hoyoverse life better happy natlan update believe ive playing years genshin
,,,positive,,nice game playing love quests interesting lot caracters issues firstly takes space secondly time loading recently dialogues muted exept paimon solve issue rewards like honkai star rail really recomend start youll going quit
,,,positive,,game just characters genshin really impact visually satisfying beautiful controls simple crossplatform experience seamless play console home laptop traveling pick left phone im spending dime dont want story immersive evolving new adventures constantly added impressed aspect recommend
,,,negative,,game playing want add controller separate company apple product provide android players calculate ratio download platforms hardly difficult ps compatibility launch
,,,negative,,game just story new wise good boring old player abyss easy end mode ok completed quest daily routine open commissions use resin close gonna uninstall soon
,,,positive,,game graphics just characters better like story abyss resin great aspects terrible terms imagine breath wild lore storyline arguably world designed remotely challenging spiral completing rinse repeat doing dailies day grind events feel mini games barely utilize
,,,positive,,game just characters lot youll want difficult open resin world barely massive variety elemental powers multiple weapons including mages long term downside insanely artifacts equip stats looking plus single run farm different types instead makes harder spend energy exactly build character developers improve
,,,positive,,game just interesting really beautiful good player pretty downsides big load hard fp currency deep plot wish little easier overall
,,,positive,,game just issue ping bad ms edit maybe connection lag crashes cutscene musicdialogues choppy point wher decided turn volume completely contacted months ago surprisingly fixed thou network provdr running smoothly stll lags smtimes
,,,negative,,game play developers bug thats causing work deleted app data cache pop says try updating fix happening friends normally
,,,positive,,game graphics characters love quests like new players great storyline world challenging different easier amazing stunning exploring region feels entering look forward updates especially suggestion translator chat box communicating countries coop make teaming
,,,positive,,game life better years genshin pick dont boring player use developers months used obsessed havent played repetitive gameplay gotten care feedback choose incorporate quality changes speaking took implement qol requested shame impacts dev team needs
,,,positive,,game ive left amazing keeps kicking trying jade chamber grab paper snow went checkpoint unlocking wasnt saved
,,,positive,,game characters playing years story recommend lag crashes amazing played gets unreasonable hate people highly bulkier phones happen lowest graphic settings worth
,,,positive,,game graphics genshin really start impact experience story open world designed different exploring feels incredible gripping breathtaking topnotch animation huge location beautifully areas exciting place special wellcrafted combination worldbuilding visuals pulls blends art exploration perfectly making fantastic finish
,,,positive,,game like play dont story good end quest open world try art isnt low device install ram devices harmful style explore collect charecter way having fun
,,,negative,,game music characters playing years experience constantly good weapons fixed qol exploration excellent animations audio enjoy properly camerasomething fixing veiw combat reason seizures eye problems touchscreen worst lack customizable key layout joke
,,,negative,,game characters update playing time like controller end use grind long character overall friends saved fun oct google points pc purchase battle passover wishes weeks didnt banner limited expensive limitation gatcha probably periods original needy support droid users
,,,positive,,game lot like going play im add good wish edit thats friends make explore addicted theres features traveler looks think standup
,,,positive,,game loading like beautiful play phone new old end little crashes app updates changes low devices tho yrs budget nows kinda faster loved suddenly got times tried reinstalling results focus giving opt change rendering distance smth
,,,negative,,graphics just update ive recently like new including character crashes isnt ram eversince getting frequent samsung gb sudden movements fighting enemies things freeze crash frames random seconds moving opening menu lowered experiment suitable
,,,positive,,game playing lot dialogues play good gonna long spend pretty fun enjoy theres things half year assure type minutes hours noticing figuring need bit googling plentiful guides advice quite stories mood appreciate skip button
,,,positive,,game just music update love star really beautiful story new good quest world instead character months ago amazing gotten art style things initially review longer anymore faith finished main patch dropped quickly stagnet asking hsr personally annoying
,,,positive,,game truly characters scenery playing quests like play story boring quest events makes overall amazing gotten exploration way traveler things quite lines combats bored noticed archon voice wishing possible ways actually
,,,negative,,game years controller company android good use games improve make feedback qol people lack support theres features actually given falls deaf ears severe considering age proper endgame content artifact loadouts custom domain creator perfect alas temporary usual tonedeaf money billion dollar
,,,negative,,game home dont open connection turn data gameplay place suddenly possible randomly decides sure explain playtime claims service pulling did screen signal happens live strong wifi fine problem
,,,positive,,game graphics characters love like play story character feels updates gameplay visuals main best action adventure aver smartphone heart touching design bestthe starts journey development awesome future
,,,positive,,game truly playing really beautiful experience impressed open great world games hard try played devices looks tried giving did best seen finally gamer fond rpg mobile damn job definitely recommended means missing thanks worked create masterpiece
,,,positive,,game characters thank playing years lot like really experience open great lore world developers work havent exciting art battle did design journey future azaming osts theme unique playstyle explained words real felt hats present say efforts
,,,positive,,game better ive playing love lot really play im dont want great feel long energy bad choose people art fighting things random need design say ad freedom lost stronger learning reminds minecraft soo details reading travelling busy
,,,positive,,game quests really story good quest world character plot stunning especially huge visuals archon say reminds overhated tons goated fontain building sao apart fans weird
,,,positive,,nice game update ive playing time like really dont long improve thats coop hate people exploration theres stories main patch understand suppose following sheep chance listen fandom cooking visual novels
,,,positive,,just characters genshin love quests like really impact play dont storyline feel different character amazing feels voice designs styles wouldve rated stars unfortunately lots mute silence loud voices right eng actors
,,,positive,,game characters genshin quests lot takes like really story boring great world exploring gets art isnt device way theres tho loved gb best mobile damn storage dedicated hell apps sorry ridiculous let youve gacha
,,,positive,,just genshin issue like star soon doing fixed says try support think need possible did rate login account requests later contact hope badly miss
,,,negative,,game natlan update playing takes time issue android load lag crashes cutscene completely wasnt gets lowest graphic settings audio moving minutes review severe strong mobile fps overlaps hearing aggravating deal turns unplayable editing newest walk inch entirely
,,,positive,,game hu tao graphics characters playing genshin love quests new recommend pretty amazing highly details favorite outfit skin
,,,positive,,characters interesting paimon like really want story easy great world doing events amazing explore fun thanks right hey guys benevolent summoning save shes adorable
,,,positive,,game characters scenery life ive playing love quests issues star recommend games used played people fun users things stories best mobile real understand small lagging understandable deserves rating helps
,,,positive,,game characters lot time really pick story long character people fun enjoy year bored content problem tons clear youre reruns available killing enjoyment arent able favorites
,,,negative,,game playing genshin like really impact phone new download good old updates worth getting gb hours annoying actually problem finally waited installing slept shades woke laggy stopped came wait wasted
,,,positive,,game just characters genshin love dialogues like experience im quest lore completing feel amazing archon voice weird fact kinich ruins gaming does alot beginning ruin
,,,positive,,game graphics playing like play im dont want story new download good player world doing long overall try exploring fun guys know funn vast questgood line
,,,positive,,just natlan quests solve like want quest world entering archon say stars right clear canjust bugs accuring pops bringing near impossible puzzles started list organized person thing chapter liyue reached iv fontaine dock occupied goodbye
,,,positive,,game love star really im player use weapons able ruin afraid hackers accounts wanna suggest obtain couldve weapon upgrading dispose theyll
,,,positive,,game characters wonderful life love quests like experience play new players wild events hard wish bad months friends coop make best awesome real lots virtual reality gameplays storylines dendro archons event unable
,,,negative,,game graphics controls im story good doing character fix forward especially make place low screen sucks dpad movable buttons adjust atleast unintentionally actions touch automatically moves control adjustable
,,,positive,,nice game graphics characters like good great storyline mini pretty try make gets explore quite voice designs cool acting freely high ar boringi permanent
,,,positive,,game characters ive playing rewards really story good spend currency wish played fun combat hours quite best say beginning super exhausting saving
,,,negative,,game just characters better update playing like quit play im dont good gonna games bad updates make played style didnt think got year actually problem felt arent fact rerunning tartaglia joined rerun atp tired redownloading
,,,positive,,nice game graphics characters better love rewards really story good use events variety weapons currency wish thats make used exploration fun problems bit artifact building absolutely mechanics reroll option substats farming primogem chests
,,,positive,,game characters update ive love issues takes space beautiful phone im new recommend ok quest use storyline hard wish edit amazing gotten archon mobile definitely understand wait thing fontaine couple sooooo ones friend taught hehe geo city glitchy
,,,negative,,loading work data keeps tried did problem storage message coming insufficient entered popping saying leaving relogging
,,,positive,,update quests story use resin great dailies events games character easier qol incredible making think skip quickly bored content strong building gi offers openworld recent improved reward engagement rewarded biggest flaws continue painfully slow process pacing prevents fast readers dialogue title
,,,positive,,game graphics update playing interesting impressed recommend player great lore storyline day friends updates especially gameplay highly year awesome absolutely mechanics captivated constant ensure stays engaged impressive cutscenes reccomended enjoyed till
,,,positive,,game characters playing good games pretty make having enemies need actually seen definitely stronger youve beginning near high mechanics adds youtubers sponsoring yards tell days fills upgrade slowly equipment doesnt mistake level possibly fight common eases introduces hooked
,,,positive,,ive playing years genshin quests recently laptop phone dont new download theres got need main problem accounts automatically hv alt acc europe server tend switch extra resources downloads asia downloaded waiting
,,,negative,,game graphics better genshin love players barely including makes point smoothly fix lowest isnt crash wifi mobile lots storage apps fps unplayable laggy incredibly setting manages dent runs optimize
,,,positive,,characters better years like really controls story new impressed good breath wild world ago amazing gotten huge explore fun combat voice actually damn felt started cool acting couple fast clone climbing gliding reactive free kept increasing size enhancing ui adding abilities reasons
,,,negative,,game just ive lot play story good end grind games harder wish care gets times hours skip annoying listen dialogue cutscenes slowly sitting replayed dozens feature resourses literally
,,,positive,,game just characters ive playing love im story player pretty wish combat skin line coming veteran hoyo diverse comes color
,,,positive,,just characters hoyoverse time paimon issue im dont players quest changes having archon voice sure future understand hope arent latest birthday celebration anecdotes voiceless awkward embarrassing normalize amused
,,,negative,,game just characters interesting takes time really point gets way skip button absurd talk said shorter sentences nerves
,,,positive,,game just issues beautiful im compatibility mode completed doing run character amazing make used didnt theres think crash domain design right recent said crashing id crashed wandering middle dialog forcing redo smoother help
,,,positive,,game issues beautiful new difficult great storyline character improve currency make repetitive gameplay qol areas fun excellent patch rpg wait grinding leveling weekly domains premium primogems come past notch
,,,negative,,game space phone dont maybe point app fix especially people devices having apps sorry does thing alright delete tells downloading whats store certain shouldnt
,,,negative,,game rewards dont mini games build load completely says huge low actually wifi fine problem awesome worked fandom save waited wait doesnt mind odd includes op teapot realmi currently using phoneand teapoti press afterwardsthenit waitto furniture inexceptit goes awaywhich allow travelers visit sweethard hoursand weather
,,,positive,,nice game graphics just characters ive time rewards like good end resin great feel long makes energy edit decided stunning getting lowered stories upgrading farming reviewed response current opinion excessive chore struggle hassle cap upgraded costs consuming
,,,positive,,game week interesting space experience phone dont new good open bug graphic excellent things problem awesome storage know doesnt task large shows check
,,,positive,,just natlan update play phone long entering played worth expensive crash fine worked soo does fontaine potato mondstadt total exspect carshs religions smooth demanding stack medium
,,,positive,,game thank hoyoverse ive time experience story games little make settings worth need improved taking break fights aesthetics spent devs putting guess rushing head loose perspective escape
,,,positive,,game like really left weeks fine worked save beginning redownloading enjoyed days entire wiped reset ended far
,,,positive,,game music playing years genshin love daily events games different amazing especially art exploration service live best adventure lots puzzles constant nowadays ups downs piece novel minigames
,,,positive,,game just playing years quests play phone dont story end great makes character hard content lots small know tell press reset icons hit enemy joystick thumb prosgreat consend smalls
,,,positive,,game just quests like play players day bad used hate got honestly cringe stuff actualy keeping motivated literaly rank discoverd parts map
,,,negative,,characters interesting like play new open use great world hard easier gameplay exploration making having fun wishes seconds skip able dialogue level id using neat forced sit frustrating lastly existing constellations wont
,,,positive,,game scenery love satisfying beautiful experience new player quest feel downside character exploring feels especially make button action bugs chests climbing territories meets expectations expectation treasure teleportation designbgm patterns consistent disappear
,,,positive,,playing play im controller android soon played lack support bored stars hope guys adding unless changed stop consider
,,,positive,,game characters genshin love quests interesting really start quit impact play good day pretty bug fix place voice missing weird know line wont normal npcs pls
,,,positive,,nice game graphics amazed like play android download good games data played gb mobile fact needed insane asphalt gangstar vegas ask extreme requirements
,,,positive,,game characters genshin love lot issues really beautiful story resin makes harder character big bad fixed data hate exploration fun times getting longer annoying building storage past delete cap ftp sice yay storge
