rating,likes,rating_label,cleaned_snippet
,,positive,nice game character life ve play interesting phone add boring old go to bad run smoothly s make style pc s samsung way service real run galaxy fan glitch january th complaint soooooo se ll bit explode
,,positive,nice game graphic ve play time play phone m game long run smoothly device device fun get menu possible mobile storage start adjust automatically feature say allow honestly glad option ll support external memory stick insert thr optimize section analyze
,,positive,game welkin character like star spending not want story good easy end grind make spend character little easier bad make way money fine d domain horrible burn bp difference resource scarcity roll artefact rate upwards dumb
,,positive,game character reward like want player good player easy grind game feel hate lack story soo puzzles thing free force lazy sooo compare dry community toxic
,,positive,game graphic truly thank mihoyo hoyoverse ve genshin take space impact play great lore storyline game character edit amazing look play fantastic consider well finally job design cool far mainly hand
,,positive,game character natlan ve year recently like experience not story new boring end great aspect lore event feel character pretty little especially play repetitive gameplay special not fun get design one release overtime disappoint emilie sethos old
,,positive,game character year lot spending adventure add player easy weapon hard character developer overall work play get fun need strong lose farming gi sign ascent lucky characterweapon artifek primogen intertwine fate gold mark forget
,,positive,game music character quest time like recommend world quality highly animation addict awesome literally perfeeect view
,,negative,game time dialogue play player boring player quest great long make cutscene dev people worth having bad skip anymore actually read listen not fight say take actual meant involve listen interaction tapping cause
,,negative,life dialogue add boring gameplay s skip button screen listen talk insane seriously literal min tap
,,positive,game life genshin like impact world feel character completely work stunning feel team visual art style combat rpg unique design openworld redefined expect pair expansive moment gorgeous personality offer endless possibility composition
,,positive,game reward good great world hard quality exploration s skip button annoying building vast obtain grind primogem honestly extensive
,,positive,game hoyoverse love not use make bad fix try hate voice problem voice let hope event act recent not en vas nahida voice everyone studio ai studio mad
,,positive,game love play laptop story constantly amazing fixing try reinstall main annoying problem let login free crashing will not work roam restarting
,,positive,game character experience new player quest lore game downside ago incredible exciting exploration make banner change main archon problem rerun impossible flaw increase frustrating number similar craft stand memorable writing age accommodate effectively
,,positive,game music character well year story use great plus overall get qol exploration fantastic fun combat artifact thing fix ton rng solid lifechange varied flexible improvement
,,negative,game play m controller provide android use wild hard bad support mobile thing not literally absurd ios platform release rd party interference
,,negative,game playing year quest lot issue take space time paimon like phone story constantly good pretty bad month repetitive get not pc think quickly fall content gacha dialogue bad someone glare early drastically fetch treat repeat not let
,,positive,nice game character life genshin like beautiful not story great aspect lore world overall amazing gameplay main unique real design thing cool tell d region fantasy inspire noticable accurately represent culture limitation skintone mention fail tell deviate plotline traveller search twin
,,positive,pick want story commission storyline character wish try people annoying design star let cool option one recent slow certain review dock personal opinion address poor reach max reputation nation unlock sort achievement interact commission board
,,positive,nice game wonderful genshin lot like star play m story end quest great world day character quality perfectly need bit main annoying fine design style dialogue sit review mark deserve unintereste patience fit short
,,positive,character well reward like abyss ok great game improve feel especially quality exploration get need bit endgame content hoyo weekly certain allow release shall competitor market stale activity chance favourite sort own
,,positive,game character ve play love time go recommend good player easy great storyline elemental pretty plot overall fix gameplay people highly fun year bored detail understand accommodate experience reaction remember write know experienced glitch pass
,,negative,game update lot play m end developer edit get low device device enjoy think anymore strong able unable size will not heavy slow request
,,positive,game graphic character genshin lot take space star impact play difficult game make overall breathtake properly problem gb need story apart understand design smooth sense rlly beginner fascinating adventure advantage theorie item rule knowledge power error bonus humor strike
,,positive,game graphic playing take space story good pretty plot app reason tho consider happen problem laggy kick admit
,,negative,game graphic like star end spend character low getting laggy suggest primogem release chance charcater begginer pkayer wasteand increase drop characterthat
,,positive,game quest lot want wish run fun fighting skip awesome turn dialogue come bunch talk leave bring potential battle ability
,,positive,game time good long pretty crash bug fix amazing enter gameplay try s second story problem smooth luck kick
,,positive,game buy welkin think mihoyo like new good open great world wish try play worth make purchase user think year voice deal able free allow previous wow enjoy month buy monthly soon cost effective korean actor
,,positive,graphic like star story good boring great lore power character pretty star guy compare interaction nation respective outside aqthe mc showcase wuwa
,,negative,game update playing year genshin time m not recommend try week lose account able go waste buy log update send email respond dollar
,,positive,graphic music well update love like story add good different character region people low banner kinda skip button design start weapon say current pls release disappointing community commission cost low build value btw taste pg
,,positive,game graphic character quest interesting lot play want good character overall bad reason pc s kinda need main artifact mobile save able grind primogem pity version require rng par lorestory yeah mid greatfor okay guarantee
,,positive,game like phone story great game plus run amazing gameplay need see mobile line run crash superb decent comment dream
,,positive,game ve play time like start long lag cutscene month run device have problem crash d ill kick mid change oppo ae d restart black
,,positive,game character love take reward like spend new good boring character pull fun get hour money design impossible say pull progress suck want
,,negative,game mode character point fun s skip button endgame adventure building slow dialogue rank hopefully endless reach curtain
,,negative,game character play end resin need worth yrs artifact money come weapon grind level item drop stay away today talent area room require guarantee defeat boss sad bcuz pride
,,negative,game character issue play story player difficult world run bad fix gameplay fun thing random deaf ear later guy bug redownloade continue not level map will not ton old early like bring fall scale exp increase refuse needle
,,positive,game genshin quest star impact m quest great bug app try update fix s suddenly give stop say omg developer th today omgnice gamegreat animationsamaze charactersleisurely nature soundlike saurrrrr gooood october close provide error fixdo asap nahidas bday complete pleaseeee tbh
,,negative,game play year take time dialogue play story great term artifact qol worst not banner limited original get lot voice gacha weapon tired improve entire change major go improvement generally form excited restriction deceive audience
,,positive,game character love interesting play story day friend amazing team animation ton turn fight roll nation scene twist emotional coaster
,,positive,game well play love reward beautiful leave difficult world different character pretty exploration enjoy battle gatcha review content design puzzle current disappointed leave sep nation undtrack toptier state frustrate lategame dull monotonous tedious socalled insult measly plain stingy
,,positive,game character believe play solve issue like phone new good storyline world character connection lag point fix network choose not have fun get hour laggy upgrading cool not server hk experience tw mo despite minor garble introduction intro disappear oh provider indosat capable provide vibrant bright collection
,,negative,nice game take not easy s way fun skip problem storage dialogue primogem mean
,,negative,game character update issue experience play want great make especially lack annoying recent usually enjoyable resolve language english voiceover speak disjoint
,,negative,user droid support needy original period probably gatcha limitation expensive limited banner not week wish passover battle purchase pc point google oct fun save friend overall character long grind use end like time update character launch compatibility ps difficult hardly platform download ratio calculate player android provide product apple company separate controller add want playing game
,,negative,tap min literal seriously insane talk listen screen button skip s gameplay bore dialogue life launch compatibility ps difficult hardly platform download ratio calculate player android provide product apple company separate controller add want playing game
,,negative,pride bcuz sad boss defeat guarantee require room area talent today away stay drop item level grind weapon come money artifact yrs worth need play character soon uninstall go to close resin use commission open routine daily quest complete ok mode end easy abyss player old boring good wise new story game
,,negative,waste wait came stop laggy woke shade sleep instal wait finally problem actually annoying hour gb get worth update download phone impact like genshin play soon uninstall go to close resin use commission open routine daily quest complete ok mode end easy abyss player old boring good wise new story game
,,negative,waste wait came stop laggy woke shade sleep instal wait finally problem actually annoying hour gb get worth update download phone impact like genshin play soon uninstall go to close resin use commission open routine daily quest complete ok mode end easy abyss player old boring good wise new story game
,,negative,literally resourse feature dozen replay sit slowly cutscene dialogue listen annoying skip hour time get care wish hard game grind play lot ve soon uninstall go to close resin use commission open routine daily quest complete ok mode end easy abyss player old boring good wise new story game
,,negative,relogging leaving say popping enter insufficient come message storage problem try keep load normally friend happen fix update try say pop cache datum app delete work cause s bug developer play game
,,negative,relogging leaving say popping enter insufficient come message storage problem try keep load normally friend happen fix update try say pop cache datum app delete work cause s bug developer play game
,,negative,let not repeat treat fetch drastically early glare someone bad dialogue gacha content fall quickly think pc not get repetitive month bad pretty story phone like paimon time space take issue lot quest joke layout key customizable lack bad touchscreen problem eye seizure reason combat veiw fix camerasomething properly enjoy audio animation excellent exploration qol fix weapon good constantly experience year play character music game
,,negative,will not constellation exist lastly frustrating sit force neat d level dialogue able skip second wish fun have make gameplay easy hard world great use open new play like interesting joke layout key customizable lack bad touchscreen problem eye seizure reason combat veiw fix camerasomething properly enjoy audio animation excellent exploration qol fix weapon good constantly experience year play character music game
,,negative,dollar billion money tonedeaf usual temporary alas perfect creator domain custom loadouts artifact content endgame proper age consider severe ear deaf fall give actually feature s support people feedback improve game use android company controller joke layout key customizable lack bad touchscreen problem eye seizure reason combat veiw fix camerasomething properly enjoy audio animation excellent exploration qol fix weapon good constantly experience year play character music game
,,negative,let not repeat treat fetch drastically early glare someone bad dialogue gacha content fall quickly think pc not get repetitive month bad pretty story phone like paimon time space take issue lot quest joke layout key customizable lack bad touchscreen problem eye seizure reason combat veiw fix camerasomething properly enjoy audio animation excellent exploration qol fix weapon good constantly experience year play character music game
,,negative,dollar respond email send update log buy waste go able account lose try recommend not m genshin year user droid support needy original period probably gatcha limitation expensive limited banner not week wish passover battle purchase pc point google oct fun save friend overall character long grind use end controller like time playing update character game
,,negative,entirely inch walk new editing unplayable turn deal aggravating hearing overlap fps mobile strong severe review minute audio setting graphic low get not completely cutscene lag load android issue time take play natlan game suitable experiment lower menu opening moving second random frame crash freeze thing enemy fight movement sudden gb samsung frequent get eversince ram not crash character include new like recently ve update graphic
,,negative,needles refuse increase exp scale fall bring like early old ton will not map level not continue redownloade bug guy later ear deaf fun gameplay fix bad run world difficult player story play issue character game suitable experiment lower menu opening moving second random frame crash freeze thing enemy fight movement sudden gb samsung frequent get eversince ram not crash character include new like recently ve update graphic
,,negative,entirely inch walk new editing unplayable turn deal aggravating hearing overlap fps mobile strong severe review minute audio setting graphic low get not completely cutscene lag load android issue time take play natlan game suitable experiment lower menu opening moving second random frame crash freeze thing enemy fight movement sudden gb samsung frequent get eversince ram not crash character include new like recently ve update graphic
,,negative,let not repeat treat fetch drastically early glare someone bad dialogue gacha quickly think pc not get repetitive month bad pretty constantly story phone like paimon time space take issue lot quest play dollar billion money tonedeaf usual temporary alas perfect creator domain custom loadouts artifact content endgame proper age consider severe ear deaf fall give actually feature s support lack people qol feedback improve game use good android company controller year game
,,negative,pride bcuz sad boss defeat guarantee require room area talent today away stay drop item level grind weapon come yrs worth need resin end play character dollar billion money tonedeaf usual temporary alas perfect creator domain custom loadouts artifact content endgame proper age consider severe ear deaf fall give actually feature s support lack people qol feedback improve game use good android company controller year game
,,negative,normally friend happen fix update try say pop cache app delete work cause s bug developer play problem fine wifi strong live happen signal screen pull service claim playtime explain sure decide randomly possible suddenly place gameplay datum turn connection open not home game
,,negative,adjustable control move automatically touch action unintentionally atleast adjust button movable dpad suck low especially forward fix character good story m control graphic problem fine wifi strong live happen signal screen pull service claim playtime explain sure decide randomly possible suddenly place gameplay datum turn connection open not home game
,,negative,launch compatibility ps difficult hardly platform download ratio calculate player provide product apple company separate controller add want entirely inch walk new editing unplayable turn deal aggravating hearing overlap fps mobile strong severe review minute move audio setting graphic low get not completely cutscene crash lag load android issue time take playing update natlan game
,,negative,interference party rd release platform ios absurd literally not thing support bad hard wild use provide controller m play entirely inch walk new editing unplayable turn deal aggravating hearing overlap fps mobile strong severe review minute move audio setting graphic low get not completely cutscene crash lag load android issue time take playing update natlan game
,,negative,let not repeat treat fetch drastically early glare someone bad dialogue gacha content fall quickly think pc not get repetitive month bad pretty constantly story paimon time space take issue lot quest year waste wait came stop laggy woke shade sleep instal wait finally problem actually annoying hour gb get worth update old good download new phone impact like genshin playing game
,,negative,redownloade tired atp rerun join tartaglia rerun fact not feel year get think not style play bad game go to not m play quit update well character waste wait came stop laggy woke shade sleep instal wait finally problem actually annoying hour gb get worth update old good download new phone impact like genshin playing game
,,negative,redownloade tired atp rerun join tartaglia rerun fact not feel year get think not style play bad game go to not m play quit update well character waste wait came stop laggy woke shade sleep instal wait finally problem actually annoying hour gb get worth update old good download new phone impact like genshin playing game
,,negative,literally resourse feature dozen replay sit slowly cutscene dialogue listen skip time get care wish hard game grind end story play lot ve waste wait came stop laggy woke shade sleep instal wait finally problem actually annoying hour gb get worth update old good download new phone impact like genshin playing game
,,negative,characterthat drop increase wasteand pkayer begginer charcater chance release primogem suggest laggy getting spend end star like adjustable control move automatically touch action unintentionally atleast adjust button movable dpad suck screen low place especially forward fix character good story m control graphic game
,,negative,problem fine wifi strong live happen signal pull service claim playtime explain sure decide randomly possible suddenly gameplay datum turn connection open not home adjustable control move automatically touch action unintentionally atleast adjust button movable dpad suck screen low place especially forward fix character good story m control graphic game
,,negative,request slow heavy will not size unable able strong anymore think enjoy device device get edit developer end play lot update adjustable control move automatically touch action unintentionally atleast adjust button movable dpad suck screen low place especially forward fix character good story m control graphic game
,,negative,request slow heavy will not size unable able strong anymore think enjoy device device get edit developer end play lot update adjustable control move automatically touch action unintentionally atleast adjust button movable dpad suck screen low place especially forward fix character good story m control graphic game
,,negative,request slow heavy will not size unable able strong anymore enjoy device device low get edit developer end lot redownloade tired atp rerun join tartaglia rerun fact not feel problem actually year get think not style play update bad game go to good not m play quit like play update well character game
,,negative,waste wait came stop laggy woke shade sleep instal wait finally annoying hour gb get worth old download new phone impact genshin redownloade tired atp rerun join tartaglia rerun fact not feel problem actually year get think not style play update bad game go to good not m play quit like play update well character game
,,negative,waste wait came stop laggy woke shade sleep instal wait finally annoying hour gb get worth old download new phone impact genshin redownloade tired atp rerun join tartaglia rerun fact not feel problem actually year get think not style play update bad game go to good not m play quit like play update well character game
,,negative,fine wifi strong live happen signal screen pull service claim playtime explain sure decide randomly possible suddenly place gameplay turn connection open not home game relogging leaving say popping enter insufficient come message storage problem try keep datum work loading
,,negative,suitable experiment lower menu opening moving second random frame freeze thing enemy fight movement sudden gb samsung frequent get eversince ram crash character new like recently ve update optimize run dent manage set incredibly laggy unplayable fps app storage lot mobile wifi crash not low fix smoothly point make include barely player love genshin well graphic game
,,negative,check reinstall uninstalled bugged notification application kick appear logo morning todays amazingbut work reset devs problem need time get device normally friend connection launch not play ve optimize run dent manage set incredibly laggy unplayable fps app storage lot mobile wifi crash not low fix smoothly point make include barely player love genshin well graphic game
,,negative,infuriate input force tab drivel basic unit npc option dialouge waste aside alt option give archon main random banner way exploration character long quest new not reward quest literally resourse feature dozen replay sit slowly cutscene dialogue listen annoying skip hour time get care wish hard game grind end good story play lot ve game
,,negative,interference party rd release platform ios absurd not thing mobile support bad hard wild use android provide controller m literally resourse feature dozen replay sit slowly cutscene dialogue listen annoying skip hour time get care wish hard game grind end good story play lot ve game
,,negative,let not repeat treat fetch drastically early glare someone bad gacha content fall quickly think pc not repetitive month bad pretty constantly phone like paimon time space take issue quest year play literally resourse feature dozen replay sit slowly cutscene dialogue listen annoying skip hour time get care wish hard game grind end good story play lot ve game
,,negative,mean primogem dialogue storage problem fun s easy not nice nerve sentence shorter say talk absurd button skip way get point time take interesting character game
,,negative,check reinstall uninstalled bugged notification application kick appear logo morning todays amazingbut work reset devs storage problem need time get device normally friend connection launch play ve not certain store s download tell delete alright thing sorry app have device people especially fix app point maybe not phone space game
,,negative,optimize run dent manage set incredibly laggy unplayable fps storage lot mobile wifi crash not low smoothly make include barely player love genshin well graphic not certain store s download tell delete alright thing sorry app have device people especially fix app point maybe not phone space game
,,negative,redownloade tired atp rerun join tartaglia rerun fact not feel year get think not style play update bad go to good m play quit like play update well character weather hoursand sweethard visit traveler allow awaywhich go inexceptit furniture waitto afterwardsthenit press teapoti phoneand currently realmi teapot op include odd mind not wait wait save fandom work awesome problem fine wifi actually low huge say completely load build game mini not reward game
,,negative,strong live happen signal screen pull service claim playtime explain sure decide randomly possible suddenly place gameplay datum turn connection open home weather hoursand sweethard visit traveler allow awaywhich go inexceptit furniture waitto afterwardsthenit press teapoti phoneand currently realmi teapot op include odd mind not wait wait save fandom work awesome problem fine wifi actually low huge say completely load build game mini not reward game
,,negative,strong live happen signal screen pull service claim playtime explain sure decide randomly possible suddenly place gameplay datum turn connection open home weather hoursand sweethard visit traveler allow awaywhich go inexceptit furniture waitto afterwardsthenit press teapoti phoneand currently realmi teapot op include odd mind not wait wait save fandom work awesome problem fine wifi actually low huge say completely load build game mini not reward game
,,negative,needles refuse increase exp scale fall bring like early old ton map not continue redownloade bug guy later ear deaf random thing fix bad run difficult player story issue game will not constellation exist lastly frustrating sit force neat d level dialogue able skip second wish fun having make exploration gameplay easy hard world great use open new play like interesting character
